9788954680424,"소설가이자 번역가. 1965년 서울에서 태어나서 이화여대 화학과를 졸업했다. 1990년대에 등장한 젊은 작가 가운데에서도 그녀는 독특하다. 이화여대 화학과에 입학한 배수아는 국어 과목을 아주 싫어했다. 그러던 어느 날 20대 후반으로 접어들었다는 자의식으로 인해 소설을 쓰게 됐다. 1993년 서점에서 단지 표지가 이쁘다는 이유로 우연히 집어든 문학잡지 [소설과 사상]에 「천구백팔십팔년의 어두운 방」이 당선되면서 등단했다.

취미로 글을 쓴다고 말하는 그녀에게서 문학적 엄숙주의는 찾아볼 수 없다. 그래서 그의 문장은 당혹스럽고 생경하며 파격적이다. 배수아의 소설에 등장하는 인물들은 하나같이 불온하고 불순한 이미지에 둘러싸여 있다. 한결같이 사회로부터 소외당한 늦된 아이들이며 주로 스무살 안팎의 주변적 존재이다. 이들은 사회규범에 적응하지 못하고 진화를 거부하는 인물이며 '스스로 선택한' 이상한 인물이다. 이러한 인물들의 신세대적 일상을 파고들며 신세대적 일상에 숨어 있는 존재의 어둠과 불안, 삶의 이중적 풍경에 대한 감각적 묘사로 일관하다. 체험과 사실성이 강조되던 우리 문학사에서 배수아는 은폐된 존재의 어둠을 탐사하며 독특한 개성을 갖춘 신세대 작가로 성장해왔고, 이제는 미적 성숙의 단계를 완성해가고 있다

『나는 이제 니가 지겨워』는 이지적이면서 자기 주장이 강한 문체를 통해 남녀관계의 속물성을 파헤치고, 독신녀의 시선을 통해 보여지는 경제ㆍ섹스ㆍ결혼관ㆍ자기세계에 대한 솔직하고 쿨한 느낌의 세계를 보여주고 있다. 『그 사람의 첫사랑』에서 주인공들은 모두 사회로부터 버림받거나 스스로 추락중이다. 그들의 배후에는 일탈과 파격, 섬뜩한 비애가 차갑게 펼쳐져 있다. 세기말의 쓸쓸함과 밀봉된 희망, 피학적인 아픔이 한꺼번에 만져지는 작품이다.

『붉은 손 클럽』은 외형의 독특함을 넘어, 단자화된 관계에 상처받으면서도 결국 또 다시 사랑을 선택하는 인간의 심리, 사랑의 대상을 향한 비이성적 감성들, 일상에 물든 관계의 지리멸렬함을 포착해 내는 배수아의 섬세한 감성과 날카로운 시선을 느낄 수 있다. 특히 배수아의 감각적이고, 이미지적인 글쓰기가 잘 나타나 있다. 『심야통신』은 저마다의 상처를 안고 살아가는 우리의 모습을 그녀 특유의 감각 더듬이로 포착하고 있는 창작집이다. 배수아는 아무것도 기억하지 않고 아무것에도 감동하지 않는 일상인의 내부에 꿈틀거리는 목마름과 허기를 이야기한다. 그녀는 후기 산업사회의 일련의 징후를 상징하고 허무주의적 인간형과 이미지와 기호로 점철된 우리 세대의 문제적인 서사 형식을 보여주면서 자기만의 자리, 자기만의 소설을 탄생시켰다.

『철수』는 인간 존재 안의 어둠과 생의 운명적인 폭력 속으로 더 한층 깊이 탐사해 들어가는 배수아 소설의 불온한 매력을 가장 잘 보여주는 작품이다. 이 작품은 섬뜩한 생의 이면을 보아버린 자의 어둡고 서늘한 내면 풍경을 그려내고 있다. 『이바나』는, 소설 속의 '나'가 외국 여행 중에 산 중고 자동차의 이름이다. 또, '그녀'로 불리는 이바나는 여행기를 편집하는 편집자에겐 신비의 여성이다. '이바나'는 어느 도시의 이름이기도 하고, 어느 지방에선 흔한 이름이기도 하다. 자신의 단편집 말미에, 배수아는 '나에게 제목이란 면상의 흉터와도 같아서 도저히 어찌할 수 없이 치명적이다. ...... 지금 나는 왜 모든 소설은 예외 없이 제목을 필요로 하는가 회의스럽다.' 고 말했다. 가장 짧은 제목이 가장 좋은 제목이라고도 했는데, 이 소설의 제목 '이바나'는 무엇인지 궁금하지 않을 수 없다. 무엇인지조차 알 수 없는 이 '이바나'는 내내 소설 속 화제의 중심인데 비해, 등장인물들의 이름은 모두 뭉개져 있다. 나, K, B, 산나, Y...... '죽기 전까지는 대도시를 빠져나갈 수 없는 사람들', 그들이 견디는 불면의 밤을 섬뜩하게 그리고 있다.

이 외에도 『어느 하루가 다르다면, 그것은 왜일까』, 『뱀과 물』, 『밀레나, 밀레나, 황홀한』, 『멀리 있다 우루는 늦을 것이다』, 『동물원 킨트』, 『이바나』, 『일요일 스키야키 식당』, 『당나귀들』, 『독학자』, 『훌』, 『에세이스트의 책상』, 『북쪽 거실』, 『올빼미의 없음』, 『서울의 낮은 언덕들』, 『알려지지 않은 밤과 하루』 등을 썼다. 산문집 『처음 보는 유목민 여인』, 창작집 『푸른 사과가 있는 국도』, 『그 사람의 첫사랑』 등과 장편소설 『랩소디 인 블루』, 『부주의한 사랑』, 『붉은손 클럽』 등이 있다. 또한 몸을 주제로 한 에세이 『내 안에 남자가 숨어 있다』를 펴냈다.

역서로는 페르난두 페소아의 『불안의 서』, 프란츠 카프카의 『꿈』, 로베르트 발저의 『산책자』, W. G. 제발트의 『현기증. 감정들』, 『자연을 따라. 기초시』, 헤르만 헤세의 『나르치스의 골드문트』, 『데미안』 등으로 2003년 한국일보문학상, 2004년 동서문학상을 수상했다. 사데크 헤다야트의 『눈먼 부엉이』, 페르난두 페소아의 『불안의 서』, 프란츠 카프카의 『꿈』, 로베르트 발저의 『산책자』, 클라리시 리스펙토르의 『달걀과 닭』과 『G. H. 에 따른 수난』 등이 있다.

전통 소설의 인물과 이야기 중심에서 벗어나 어떻게 서술 자체가 이야기를 만들어가는지를 보여주는 작품인 「무종」을 통해 2010년 제34회 이상문학상 우수상을 수상하였으며, ‘월요일 독서클럽’ 회원으로 활동하기도 했다. 독특한 문체와 색깔로 열혈 독자군을 거느려 왔던 그녀는 이제 사유하는 문장의 힘으로 새로운 독자들과도 만나고 있다."
9788954680431,"소설가이자 번역가. 1965년 서울에서 태어나서 이화여대 화학과를 졸업했다. 1990년대에 등장한 젊은 작가 가운데에서도 그녀는 독특하다. 이화여대 화학과에 입학한 배수아는 국어 과목을 아주 싫어했다. 그러던 어느 날 20대 후반으로 접어들었다는 자의식으로 인해 소설을 쓰게 됐다. 1993년 서점에서 단지 표지가 이쁘다는 이유로 우연히 집어든 문학잡지 [소설과 사상]에 「천구백팔십팔년의 어두운 방」이 당선되면서 등단했다.

취미로 글을 쓴다고 말하는 그녀에게서 문학적 엄숙주의는 찾아볼 수 없다. 그래서 그의 문장은 당혹스럽고 생경하며 파격적이다. 배수아의 소설에 등장하는 인물들은 하나같이 불온하고 불순한 이미지에 둘러싸여 있다. 한결같이 사회로부터 소외당한 늦된 아이들이며 주로 스무살 안팎의 주변적 존재이다. 이들은 사회규범에 적응하지 못하고 진화를 거부하는 인물이며 '스스로 선택한' 이상한 인물이다. 이러한 인물들의 신세대적 일상을 파고들며 신세대적 일상에 숨어 있는 존재의 어둠과 불안, 삶의 이중적 풍경에 대한 감각적 묘사로 일관하다. 체험과 사실성이 강조되던 우리 문학사에서 배수아는 은폐된 존재의 어둠을 탐사하며 독특한 개성을 갖춘 신세대 작가로 성장해왔고, 이제는 미적 성숙의 단계를 완성해가고 있다

『나는 이제 니가 지겨워』는 이지적이면서 자기 주장이 강한 문체를 통해 남녀관계의 속물성을 파헤치고, 독신녀의 시선을 통해 보여지는 경제ㆍ섹스ㆍ결혼관ㆍ자기세계에 대한 솔직하고 쿨한 느낌의 세계를 보여주고 있다. 『그 사람의 첫사랑』에서 주인공들은 모두 사회로부터 버림받거나 스스로 추락중이다. 그들의 배후에는 일탈과 파격, 섬뜩한 비애가 차갑게 펼쳐져 있다. 세기말의 쓸쓸함과 밀봉된 희망, 피학적인 아픔이 한꺼번에 만져지는 작품이다.

『붉은 손 클럽』은 외형의 독특함을 넘어, 단자화된 관계에 상처받으면서도 결국 또 다시 사랑을 선택하는 인간의 심리, 사랑의 대상을 향한 비이성적 감성들, 일상에 물든 관계의 지리멸렬함을 포착해 내는 배수아의 섬세한 감성과 날카로운 시선을 느낄 수 있다. 특히 배수아의 감각적이고, 이미지적인 글쓰기가 잘 나타나 있다. 『심야통신』은 저마다의 상처를 안고 살아가는 우리의 모습을 그녀 특유의 감각 더듬이로 포착하고 있는 창작집이다. 배수아는 아무것도 기억하지 않고 아무것에도 감동하지 않는 일상인의 내부에 꿈틀거리는 목마름과 허기를 이야기한다. 그녀는 후기 산업사회의 일련의 징후를 상징하고 허무주의적 인간형과 이미지와 기호로 점철된 우리 세대의 문제적인 서사 형식을 보여주면서 자기만의 자리, 자기만의 소설을 탄생시켰다.

『철수』는 인간 존재 안의 어둠과 생의 운명적인 폭력 속으로 더 한층 깊이 탐사해 들어가는 배수아 소설의 불온한 매력을 가장 잘 보여주는 작품이다. 이 작품은 섬뜩한 생의 이면을 보아버린 자의 어둡고 서늘한 내면 풍경을 그려내고 있다. 『이바나』는, 소설 속의 '나'가 외국 여행 중에 산 중고 자동차의 이름이다. 또, '그녀'로 불리는 이바나는 여행기를 편집하는 편집자에겐 신비의 여성이다. '이바나'는 어느 도시의 이름이기도 하고, 어느 지방에선 흔한 이름이기도 하다. 자신의 단편집 말미에, 배수아는 '나에게 제목이란 면상의 흉터와도 같아서 도저히 어찌할 수 없이 치명적이다. ...... 지금 나는 왜 모든 소설은 예외 없이 제목을 필요로 하는가 회의스럽다.' 고 말했다. 가장 짧은 제목이 가장 좋은 제목이라고도 했는데, 이 소설의 제목 '이바나'는 무엇인지 궁금하지 않을 수 없다. 무엇인지조차 알 수 없는 이 '이바나'는 내내 소설 속 화제의 중심인데 비해, 등장인물들의 이름은 모두 뭉개져 있다. 나, K, B, 산나, Y...... '죽기 전까지는 대도시를 빠져나갈 수 없는 사람들', 그들이 견디는 불면의 밤을 섬뜩하게 그리고 있다.

이 외에도 『어느 하루가 다르다면, 그것은 왜일까』, 『뱀과 물』, 『밀레나, 밀레나, 황홀한』, 『멀리 있다 우루는 늦을 것이다』, 『동물원 킨트』, 『이바나』, 『일요일 스키야키 식당』, 『당나귀들』, 『독학자』, 『훌』, 『에세이스트의 책상』, 『북쪽 거실』, 『올빼미의 없음』, 『서울의 낮은 언덕들』, 『알려지지 않은 밤과 하루』 등을 썼다. 산문집 『처음 보는 유목민 여인』, 창작집 『푸른 사과가 있는 국도』, 『그 사람의 첫사랑』 등과 장편소설 『랩소디 인 블루』, 『부주의한 사랑』, 『붉은손 클럽』 등이 있다. 또한 몸을 주제로 한 에세이 『내 안에 남자가 숨어 있다』를 펴냈다.

역서로는 페르난두 페소아의 『불안의 서』, 프란츠 카프카의 『꿈』, 로베르트 발저의 『산책자』, W. G. 제발트의 『현기증. 감정들』, 『자연을 따라. 기초시』, 헤르만 헤세의 『나르치스의 골드문트』, 『데미안』 등으로 2003년 한국일보문학상, 2004년 동서문학상을 수상했다. 사데크 헤다야트의 『눈먼 부엉이』, 페르난두 페소아의 『불안의 서』, 프란츠 카프카의 『꿈』, 로베르트 발저의 『산책자』, 클라리시 리스펙토르의 『달걀과 닭』과 『G. H. 에 따른 수난』 등이 있다.

전통 소설의 인물과 이야기 중심에서 벗어나 어떻게 서술 자체가 이야기를 만들어가는지를 보여주는 작품인 「무종」을 통해 2010년 제34회 이상문학상 우수상을 수상하였으며, ‘월요일 독서클럽’ 회원으로 활동하기도 했다. 독특한 문체와 색깔로 열혈 독자군을 거느려 왔던 그녀는 이제 사유하는 문장의 힘으로 새로운 독자들과도 만나고 있다."
9788954680615,"어린 시절, 책 그리고 영화 속에서 시간을 보냈다. 이미지를 만들고 싶다는 생각으로 한국예술종합학교에 들어가 영화 연출을 공부했다. 졸업 후 십 년간, 발표가 기약되지 않은 글을 썼다. 2011년 팟캐스트 ‘네시이십분 라디오’를 만들어 세상 어딘가에 분명히 존재하지만 눈에 띄지 않는, 그러나 가치 있는 책과 작가를 소개해왔다. 그러다가 소설 리뷰 웹진 ‘소설리스트’에서 소설을 리뷰하고, EBS [지식채널 e]에서 대본을 쓰게 되었다. 작가와 독자를 잇는 낭독회, ‘개와 고양이의 라디오 워크숍’ ‘지금 이곳에서 시작하는 글쓰기’와 같은 창작워크숍을 지속해왔다. 2017년, 문학동네 시 부문 신인상을 받았고 이듬해 사랑, 기억, 이미지를 테마로 홀로 써온 글들을 묶어 『사랑의 잔상들』, 이름 없는 민주화운동가였던 아버지와 가족의 삶에 대해 쓴 소설 『진주』, 그리고 시집 『발이 없는 나의 여인은 노래한다』를 펴냈다. 앞으로도 특정 장르에 속하기보다 새로운 공간을 개척하는 글을 쓰고자 한다."
9788954680691,"1973년 경기도 수원 출생으로 청주대 철학과와 서울예대 문예창작과를 졸업하였다. 1999년 [동아일보] 신춘문예에 단편소설 「레고로 만든 집」이 당선되어 등단했고, 「서른세 개의 단추가 달린 코트」가 2001년 「계단」이 연이어 『현장 비평가가 뽑은 올해의 좋은 소설 2001』에 실렸으며, 「모자」는 『2001년 현대문학상 수상 작품집』에, 「그림자들」은 『2001년 이상문학상 수상 작품집』에 수록되었다. 「유턴지점에 보물지도를 묻다」로 현대문학상을 수상했다. 「부메랑」으로 2011년 11회 황순원문학상을 수상했다. 그 밖에 이수문학상, 이효석문학상, 오늘의 젊은 예술가상, 한국일보문학상, 김승옥문학상 대상을 수상했다. 소설집 『레고로 만든 집』, 『거기, 당신?』, 『감기』, 『웃는 동안』, 『베개를 베다』, 『날마다 만우절』 등이 있고, 중편소설 『첫 문장』, 장편소설 『구경꾼들』, 『상냥한 사람』, 중편소설 『첫 문장』 등이 있다."
9788954680844,"1988년 『문학사상』에 시가, 1994년 [동아일보] 신춘문예에 평론이 당선된 후 시 쓰기와 평론 활동을 병행해오고 있다. 시집으로 『자작나무 내 인생』, 『흰 책』, 『삼천갑자 복사빛』, 『와락』, 『은는이가』, 『봄이고 첨이고 덤입니다』, 시학서로 『패러디 시학』, 교과서 시 다시 읽기 책으로 『시심전심』, 평론집으로 『천 개의 혀를 가진 시의 언어』, 『오룩의 노래』, 『파이의 시학』, 『시론』, 시 해설집으로 『밥』, 『어느 가슴엔들 시가 꽃피지 않으랴 1』, 『돈 詩』 등이 있다. 유심작품상, 소월시문학상, 청마문학상, 현대시작품상 등을 수상했다."
9788954681155,"소심한 O형. 덩치 큰 겁쟁이. 호기심은 많지만 그 호기심이 식는 것도 빠르다. 사람의 저열한 속내나, 진심을 가장한 말 뒤에 도사리고 있는 악의에 대해 상상하는 것을 좋아한다. 2012년 대한민국 스토리 공모대전에서 「백일청춘」으로 우수상을 수상했으며, 2016년 YES24 e-연재 공모전 ‘사건과 진실’에서 「봉명아파트 꽃미남 수사일지」로 대상을 수상, 2018년 CJ E&M과 카카오페이지가 공동으로 주최한 추미스 공모전에서 「내가 죽였다」로 금상을 수상했다.

중국과 태국에 수출되기도 한 데뷔작 『더블』을 비롯하여, 『악의-죽은 자의 일기』, 『봉명아파트 꽃미남 수사일지』, 『지금 죽으러 갑니다』, 『유괴의 날』, 『내가 죽였다』 등의 장편소설을 출간했다. 또한 앤솔러지 『취미는 악플, 특기는 막말』, 『그것들』, 『카페 홈즈에 가면?』, 여성 미스터리 소설집 『단 하나의 이름도 잊히지 않게』 등에 참여하며 왕성한 집필 활동을 하고 있다.

20대에 로맨스 소설을 썼던 그는 『더블』이라는 작품을 내놓으며 스릴러로 전향하여 ‘놀라운 페이지 터너’ ‘한국 스릴러 문학의 유망주’라는 평과 함께 주목받았다. ‘사람의 저열한 속내나, 진심을 가장한 말 뒤에 도사리고 있는 악의에 대해 상상하는 것을 좋아한다’고 말하는 그의 장점은 흥미로운 설정과 뛰어난 가독성이다. 특히나 『홍학의 자리』에서는 이제까지 쌓아 올린 경험과 특장점이 집약되어 있다. 곧바로 스토리에 집중하게 만드는 설정과 가독성은 물론, 매 챕터마다 긴장의 끈을 놓을 수 없게 만드는 탁월한 스토리텔링, 완성도 높은 캐릭터와 짜임새 있는 플롯으로 스릴러 작가로서의 존재감을 선명하게 드러내고 있다."
9788954681179,"고려대학교 국어국문학과를 졸업했다. 2013년 중편소설 「쇼코의 미소」로 [작가세계] 신인상을 받으며 등단했다. 소설집 『쇼코의 미소』 『내게 무해한 사람』이 있다. 허균문학작가상, 김준성문학상, 이해조소설문학상, 한국일보문학상, 제5회, 제8회, 제11회 젊은작가상을 수상했다."
9788954681230,1986년 수원 출생. 서울과 암스테르담에서 커뮤니케이션학을 공부했다. 2019년 장편소설 「최단경로」로 제25회 문학동네소설상을 수상하며 작품활동을 시작했다.
9788954681650,"1891년 미국 시카고에서 서인도제도 출신의 흑인 아버지와 백인 어머니 사이에서 태어났다. 검은 피부를 타고나 인종 차별에 일찍 눈뜨게 된 그는 1920년 뉴욕으로 이주한 뒤 할렘 르네상스를 주도하던 예술가들과 교류하면서 작품 활동을 시작했다. 1928년 첫 소설 『유사』, 1929년 『패싱』을 출간했다. 이 작품으로 그는 뛰어난 업적을 이룬 흑인들에게 수여하는 윌리엄 하몬 브론즈 어워드와 구겐하임 지원금을 받았다. 그러나 초기의 활발한 창작 활동에도 불구하고 이혼에 따른 경제적 어려움, 출판사와의 불화 등으로 세 번째 소설을 출판하지 못한 채 1964년 세상을 떠났다. 흑인 여성 최초 퓰리처상 수상 작가인 앨리스 워커 등이 1980년대 이후 다른 흑인 여성 작가를 재발굴하기 시작하면서 넬라 라슨의 작품이 재평가되고 문학사 속에 위치가 복원되었다."
9788955617412,"20세기 후반 일본 순문학을 대표하는 소설가. 비를 피하려고 잠시 들른 서점에서 읽은 유명작가의 단편소설이 너무나 재미있어서 카피라이터를 그만두고 전업작가의 길을 걷게 됐다. 1947년 일본 고베에서 태어났다. 오테몬학원대학 문학부를 졸업하고 산케이 광고회사에서 카피라이터로 근무하다가 1975년 신경불안증으로 퇴직했다. 이후 본격적으로 소설을 쓰기 시작하여 1977년 『진흙탕 강』으로 다자이오사무상을 받으며 데뷔했고, 이듬해 1978년 『반딧불 강』으로 아쿠타가와상을 받으면서 작가로서의 지위를 다졌다. 폐결핵으로 일 년 가까이 요양한 뒤 곧 다시 왕성한 집필활동을 계속한다. 1987년에는 『준마』를 발표하면서 역대 최연소인 40세로 요시카와에이지 문학상을 받았고, 같은 작품으로 JRA상 마사문화상을 받았다. 이후 아쿠타가와상, 미시마유키오상 심사위원을 비롯하여 각종 문예지의 신인상 심사위원을 역임했다.

대표작으로는 ‘강 3부작’으로 불리는 「흙탕물 강」, 「반딧불 강」, 『도톤보리 강』, 서간체 문학인 『금수』, 자전적 대하 작품 연작으로 영화화되거나 라디오 드라마로 만들어지기도 한 『유전의 바다』(1984), 『도나우의 여행자』(1985) 등이 있으며 『사랑은 혜성처럼』, 『해안열차』, 『인간의 행복』, 『이별의 시작』, 『피서지의 고양이』, 『반딧불 강』, 『우리가 좋아했던 것』『파랑이 진다』『환상의 빛』 등의 작품이 우리말로 번역되었다."
9788955824957,"포리스트 카터는 현대가 잊고 있던 인디언의 정신과 삶을 다시금 일깨워 준 작가이다. 그가 인디언에 주목하게 된 것은 할아버지와의 관계로부터 시작된다. 그의 할아버지는 농장과 가게를 운영하고 있었는데, 그는 체로키 인디언의 혈통을 이어 받은 이였고 그로 인해 포리스트 카터의 삶에는 인디언의 사고와 문화가 배어나게 되었다. 그의 이름은 인디언들처럼 '작은 나무'였으며 필요한 것 외에는 대지에서 가져가지 않는 것 등 인디언의 생활철학들을 배웠다. 또한 자연의 신성함과 동물들의 의미, 농작의 원리에 대한 인디언들의 전통을 배우며 미국 사회가 말살시켜버린 인디언들의 문화가 가진 아름다움을 이해하게 되었다.
그의 이런 어린 시절은 그대로 책에 담겨 있다. 그의 책은 인디언의 그것과 닮아 자서전 형식의 자연스러움으로 표현되고 있다. 『내 영혼이 따뜻했던 날들』은 입에서 입으로 전해져내려오던 인디언들의 가르침을 전하고 있으며 『제로니모』에서는 전설적인 아파치 추장으로 미국인들에게 대항했던 제로니모의 삶을 통하여 미국사회가 바라보지 못한 인디언의 이면에 대하여 다루고 있다."
9788956057842,"미국 브라운 대학교에서 물리학과 컴퓨터공학을 전공한 과학도이자 ‘전 세계 과학소설계의 보물’이라는 찬사를 듣고 있는 소설가. 동시대 과학소설 작가들의 인정과 동시대 과학소설 독자들의 기대를 한 몸에 받고 있는 작가로 휴고상을 4번, 로커스상을 4번, 네뷸러상을 4번 수상했다.

1990년 발표한 첫 단편 「바빌론의 탑」으로 역대 최연소 네뷸러상 수상자라는 영예를 안았으며, 이후 발표하는 작품마다 스터전상, 휴고상, 네뷸러상을 휩쓸며 평단과 독자들의 주목과 지지를 받았다. 「인류 과학의 진화」, 「우리가 해야 할 일」 두 작품이 세계적인 과학 학술지 [네이처]에 게재됐다.

『당신 인생의 이야기』는 테드 창의 첫 번째 작품집으로 과학적 상상력에 기초한 전혀 다른 차원의 소재와 시종일관 탄성을 자아내게 하는 놀라운 서사를 통해 최고의 과학소설에 수여되는 모든 상을 석권하며 전 세계 21개 언어로 번역 출간되었다."
