9788937460432,"1906년 4월 13일 아일랜드 더블린 남쪽 폭스록에서 유복한 신교도 가정의 차남으로 태어나 생애의 대부분을 프랑스에서 보냈다. 더블린의 트리니티 대학교에서 프랑스 문학과 이탈리아문학을 공부하고 단테와 데카르트에 심취했던 베케트는 졸업 후 1920년대 후반 파리 고등 사범학교 영어 강사로 일하게 된다. 당시 파리에 머물고 있었던 제임스 조이스에게 큰 영향을 받은 그는 조이스의 『피네건의 경야』에 대한 비평문을 공식적인 첫 글로 발표하고, 1930년 첫 시집 『호로스코프』를, 1931년 비평집 『프루스트』를 펴낸다. 이어 트리니티 대학교에서 프랑스어를 가르치게 되지만 곧 그만두고, 1930년대 초 첫 장편소설 『그저 그런 여인들에 대한 꿈』(사후 출간)을 쓰고, 1934년 첫 단편집 『발길질보다 따끔함』을, 1935년 시집 『에코의 뼈들 그리고 다른 침전물들』을, 1938년 장편소설 『머피』를 출간하며 작가로서 발판을 다진다. 1937년 파리에 정착한 그는 제2차 세계대전 중 레지스탕스로 활약하며 프랑스에서 전쟁을 치르고, 1946년 봄 프랑스어로 글을 쓰기 시작한 후 1989년 숨을 거둘 때까지 수십 편의 시, 소설, 희곡, 비평을 프랑스어와 영어로 번갈아가며 쓰는 동시에 자신의 작품 대부분을 스스로 번역한다. 전쟁 중 집필한 장편소설 『와트』에 뒤이어 쓴 초기 소설 3부작 『몰로이』, 『말론 죽다』, 『이름 붙일 수 없는 자』가 1951년부터 1953년까지 프랑스 미뉘 출판사에서 출간되고, 1952년 역시 미뉘에서 출간된 희곡 『고도를 기다리며』가 파리, 베를린, 런던, 뉴욕 등에서 수차례 공연되고 여러 언어로 출판되며 명성을 얻게 된 베케트는 1961년 보르헤스와 공동으로 국제 출판인상을 받고, 1969년 노벨 문학상을 수상한다. 희곡뿐 아니라 라디오극과 텔레비전극 및 시나리오를 집필하고 직접 연출하기도 했던 그는 당대의 연출가, 배우, 미술가, 음악가 들과 지속적으로 교류하며 평생 실험적인 작품 활동에 전념했다. 1989년 12월 22일 파리에서 숨을 거뒀고, 몽파르나스 묘지에 묻혔다."
9788937460449,작가 정보가 없습니다.
9788937460463,"본명은 에릭 아서 블레어Eric Arther Blair. 인도에서 태어나 영국의 대표적인 작가이자, 언론인, 비평가로 활동하였다. 1903년 6월 25일, 영국령 인도의 벵골 주 모티하리에서 세관관리의 아들로 태어났다. 8세 때 사립예비학교에 들어갔으나, 이곳에서 상류층 아이들과의 심한 차별을 맛보며 우울한 소년시절을 보냈고, 장학생으로 들어간 이튼교에서의 학창시절 역시 계급 차이를 뼈저리게 실감하는 계기가 되었다. 졸업 후 대학 진학을 포기하고 1922년부터 5년간 미얀마에서 대영제국 경찰로 근무했으나 영국 제국주의가 저지르는 악마적 만행을 두 눈으로 목격한 그는 자신의 직업에 회의를 느껴 직장을 그만두고 파리로 건너가 작가수업을 쌓았다.

유럽으로 돌아와 어린 시절부터 꿈이었던 작가가 되기로 한다. 파리와 런던에서 노숙자, 접시닦이, 교사, 서점 직원 등 여러 직업을 전전하는 속에서도 소설을 쓰고 서평과 에세이를 발표했다. 1933년에 파리와 런던에서 겪었던 생활을 바탕으로 한 첫 소설 『파리와 런던의 밑바닥생활(Down and Out in Paris and London)』과 1935년 식민지 백인 관리의 잔혹상을 묘사한 소설 『버마 시절』이다. 이 시기부터 그는 죽음의 원인이 된 결핵을 앓기 시작했다. 사회 정의의 문제에 민감했고, 진실을 알리고자 하는 욕구가 강했던 그는 첫 소설 『버마 시절』에 이어 『목사의 딸』, 『그 엽란을 날게 하라』를 출간했고, 잉글랜드 북부 노동자의 가난한 삶을 그린 사회주의 색채가 짙은 르포르타주 『위건 부두로 가는 길』을 발표했다. 중·장년 시절에는 버마(현재 미얀마)에서 경찰관으로 재직했지만, 식민지배의 불합리성을 목격한 후 사직을 하고 영국으로 이주하면서 빈곤한 생활을 겪다가 전체주의를 혐오한 그는 스페인 내전에 가담하여 부상을 입기도 했다. 그 체험을 기록한 1936년 『카탈로니아 찬가(Homage to Catalonia)』는 뛰어난 보도 문학으로 평가된다.

1941년부터 1943년까지 BBC방송국에서 일하기도 했다. 이후 [트리뷴]의 문학 담당 편집자로 일하면서 정치와 문학 분야의 논평을 정기적으로 썼다.그리고 2차 대전 직후인 1945년에는 러시아 혁명과 스탈린의 배신을 우화로 그린 『동물농장』으로 일약 명성을 얻게 되었다. 그러나 그해 그는 아내를 잃고 자신도 지병인 폐결핵의 악화로 병원 신세를 지게 된다. 1946년 스코틀랜드 주라 섬에 머물며 작품 활동을 계속하여 전체주의의 종말을 기묘하게 묘사한 디스토피아 소설 『1984년』을 집필하였고, 1949년에 출간되었다. 『1984년』은 전제주의라는 거대한 지배 시스템 앞에 놓인 한 개인이 어떻게 저항하다가 어떻게 파멸해 가는지, 그 과정과 양상, 그리고 배후를 적나라하게 보여주는 디스토피아 소설이다. 작품의 무대인 오세아니아는 전체주의의 극한적인 양상을 띠고 있는 나라이다. 오세아니아의 정치 통제 기구인 당은 허구적 인물인 빅 브라더를 내세워 독재 권력의 극대화를 꾀하는 한편, 정치 체제를 항구적으로 유지하기 위해 텔레스크린, 사상경찰, 마이크로폰, 헬리콥터 등을 이용하여 당원들의 사생활을 철저하게 감시한다. 당의 정당성을 획득하는 것과 동시에 당원들의 사상적인 통제를 위해 과거의 사실을 끊임없이 날조하고, 새로운 언어인 신어를 창조하여 생각과 행동을 속박함은 물론, 인간의 기본적인 욕구인 성욕까지 통제한다. 『1984년』은 올더스 헉슬리의 『멋진 신세계』, 예브게니 이바노비치 자먀찐의 『우리들』과 더불어 디스토피아를 다룬 소설 가운데 대표작으로 꼽히며, 이후 많은 예술작품에 영향을 주었다. 주인공 윈스턴 스미스는 이런 당의 통제에 반발을 느끼고 저항을 꾀하지만, 오히려 함정에 빠져 사상경찰에 체포되고, 혹독한 고문 끝에 존재하지도 않는 인물 '골드스타인'을 만났다고 자백하고, 결국 당이 원하는 것을 아무런 저항 없이 받아들이는 무기력한 인간으로 전락한다. 『1984년』은 오웰을 20세기 최고의 영향력 있는 작가로 만들었다.

장르에 상관없이 언제나 확고한 정치적 신념을 바탕으로 글을 썼으며 소설, 에세이, 르포, 평론 등 700여 편의 작품을 남기고, 1950년 47세의 나이로 세상을 떠났다. 조지 오웰의 47년간의 삶 중 시대적 배경은 전쟁으로 인한 평화가 무너지는 격변기로 두 차례의 세계대전이 일어났으며 전체주의(집단주의)와 공산주의, 사회주의, 민주주의 사상이 다변화되면서 사회 부조리를 고발하는 대표 언론가로 상징된다. ‘조지 오웰’은 21세기 새 시대를 맞이하여 199년 영국 BBC 조사한 ‘지난 천년동안 가장 위대한 작가 3위’, 2008년 [더 타임스]가 선정한 영국 작가 50인의 2위로 선정되었다. 게다가 영문학에서는 ‘오웰주의’, '오웰주의자'라는 뜻의 Orwellism이나 Orwellian이라는 표현이 따로 있을 정도이니, 이 정도면 그가 서양 문학사에서 차지하는 위치는 쉽게 짐작할 수 있을 것이다. 그는 주로 당대의 문제였던 계급 의식을 풍자하고 이것을 극복하는 길을 제시하였으며, 또 일찍이 스탈린주의의 본질을 꿰뚫고 거기서 다시 현대사회의 바닥에 깔려 있는 악몽과 같은 전체주의의 풍토를 작품에 정착시켰다. 그는 ‘나는 왜 쓰는가’라는 글에서, 글을 쓰는 이유를 “전체주의에 반대하고, 민주적 사회주의를 지지하기 위한 것”이라고 밝히고 있으며, 자신의 글 중에서 정치적 목적을 가지고 쓴 글들만이 생명력을 가지고 있다고 이야기하고 있다.

주요 저서로는 『파리와 런던의 밑바닥 생활』 ,『버마의 나날』, 『목사의 딸』, 『엽란을 날려라』, 『위건 부두로 가는 길』, 『카탈로니아 찬가』, 『숨쉬러 올라오기』, 『고래 뱃속에서』, 『사자와 일각수』, 『동물 농장』, 『비판적 에세이』, 『영국 사람들』, 『1984년』 등이 있다."
9788937460470,"전 세계적인 베스트셀러 『호밀밭의 파수꾼』의 작가. 1919년 1월 1일 뉴욕에서, 육류와 치즈 수입상을 하던 유대계 아버지 솔로몬 샐린저와 기독교도인 아일랜드계 어머니 미리엄 샐린저 사이에서 태어났다. 13살 때 맨해튼의 유명한 맥버니 중학교에 입학했으나 1932년 성적 불량으로 퇴학을 당한 후, 15살이 되던 해에 펜실베니아 웨인에 있는 밸리 포지 육군 사관학교에 들어갔다.

이 학교는 후에 『호밀밭의 파수꾼』의 주인공 홀든 콜필드가 퇴학을 당하는 펜시 고등학교의 모델이 되었다. 샐린저는 이 학교에서 연극에 관심이 많아 문예 편집위원으로 활동하기도 했다. 1937년 뉴욕대학에 입학했으나 중퇴하였고, 이후 어시너스 칼리지와 컬럼비아 대학 등에서 문예창작 수업을 받았다.

1940년 [휘트 버넷 단편]지에 단편소설 『젊은이들』이 실리면서 등단했다. 1942년에는 2차 세계대전 중 보병으로 소집되어 '노르망디 상륙작전'에 참가하였으며, 군 생활을 하는 동안 여러 작품을 발표했다. 1948년에 [뉴요커]지에 단편소설 『바나나피시를 위한 완벽한 날』이 실리면서 주목받기 시작했으며, 그외에도 [뉴요커]지에 다수의 단편을 발표했다. 이후 샐린저는 32살이 되던 1952년에 발표한 자전적 장편소설 『호밀밭의 파수꾼』이 전후 미국 문학의 걸작으로 극찬 받으면서 세계적인 베스르셀러 작가로서의 명성을 얻게 된다.

『호밀밭의 파수꾼』은 주인공 홀든 콜필드가 학교에서 또 한번 퇴학을 당해 집에 돌아오기까지, 누군가 자신을 붙잡아주기를 바라며 헤매이는 48시간을 독백 형식으로 담고 있다. 이 책은 거침없는 언어와 사회성 짙은 소재로 출간되자 마자 엄청난 논쟁을 일으키며 베스트셀러가 되었다. 영화계는 물론 사이먼과 가펑클, 그린데이, 오프스프링, 빌리 조엘 등 수많은 뮤지션들을 콜필드 신드롬에 빠지게 하였고, 20세기 최고의 미국 현대소설로 칭송받고 있는 책이다. 지금도 매년 30만 부가 팔리고 있으며, 존 레논이 암살되던 때에 피격자가 이 책을 들고 있던 것으로도 유명하다.

『호밀밭의 파수꾼』은 학교에서 퇴학을 당한 문제아가 주인공으로 등장하고 거침 없는 비속어 때문에 많은 중 · 고등학교에서 금서로 지정되기도 했지만, 지금은 20세기 최고의 베스트셀러이자 청소년들이 가장 많이 찾는 책 중의 하나이다. 그 밖의 저서로는 단편소설집 『아홉 가지 이야기』, 중편소설집 『프래니와 주이』 『목수들아, 대들보를 높이 올려라』 등이 있다. 2010년 1월 27일 뉴햄프셔주 코니쉬의 자택에서 노환으로 세상을 떠났다."
9788937460500,작가 정보가 없습니다.
9788937460586,작가 정보가 없습니다.
9788937460616,"유럽의 허무주의, 미래파, 표현주의의 영향을 받은 일본 문학 유파인 신감각파를 대표하는 작가. 난해한 문체 속에 내밀하게 숨겨진 탐미와 죽음, 그 미학적 경지의 불가해성으로 일본 평론가들 사이에서조차 그의 언어체계가 보여주는 의미망에 대한 논란이 끊이지 않고 있다.

1899년 오사카에서 태어났다. 어려서 부모와 조부모, 하나뿐인 누이와 사별했다. 사별한 혈육을 추모하고, 외롭고 허무한 인생을 견뎌내는 방법으로 그는 문학을 선택한다. 동경대 국문학과 졸업 후 신진작가 약 20명과 함께 「문예시대」를 창간한다. 직접 창간사를 썼던 「문예시대」는 일본문학계에 ‘신감각파’의 탄생을 알리는 신호가 된다. 그러나 신감각파 문학은 1927년 일원이던 아쿠다가와 류우노스케의 돌연한 자살로 사실상 흐지부지 끝을 맺는다. 다행하게도 이 무렵부터 그의 문학은 독자적인 미적 세계를 형성하기 시작한다. 그리하여 『설국』에 이르러 일본의 현대문학을 대표하는 작가로서 자리매김한다.

작가 자신이 ‘가장 마음에 드는 작품’으로 꼽았던 『설국』은 그다지 길지 않은 중편소설이지만 기고에서 완성까지 무려 13년의 세월이 걸린 작품. 발표 도중 「문예간담회 상」을 받았다. 시작은 1935년 「문예춘추」 1월호였고, 끝은 1947년 「소설신조」 10월호였다.

1968년 노벨문학상을 수상한다. 작가로서 영예의 절정에 이른 시기, 그러나 1972년 4월 16일 그는 자살로서 돌연 생을 마감한다. 제자인 미시마 유키오(三島由紀夫)가 자결한 뒤 얼마 되지 않았을 때의 죽음이다. 그의 자살에의 이유에 대해 특별하게 알려진 이유는 없다. 그가 자살할 당시 책상에는 쓰다 중단한 원고와 뚜껑이 열린 만년필이 놓여 있었을 뿐. 그의 작품으로는 『이즈의 무희』, 『서정가』, 『금수(禽獸)』, 『천우학(千羽鶴』, 『산의 소리』, 『잠자는 미녀』, 『아름다움과 슬픔』, 『고도(古都)』등이 있다.

일본 최초의 노벨문학상 수상작품인 가와바타 야스나리의 『설국』은 무슨무슨상으로 소개되기 보다는 그 자체의 서정적 아름다움을 강조하는 것이 책에 대한 예의일지도 모른다. 이미 여러번 번역되어 많은 사람들이 읽은 책이지만, 가와바타 야스나리의 백미랄 수 있는 '눈 지방의 정경을 묘사하는 서정성 뛰어난 감각적인 문체'를 표현하는 방법은 여러번 읽어도 여전히 감동을 준다. 이 작품의 특징은 인물과 배경 묘사가 치밀한 데 반해, 그 안의 두드러진 줄거리가 없다는 것이다. 인간 행위의 유한함을 자연의 무한함에 비교하려고 했던 저자의 의도를 간접적으로 느낄 수 있다.

또다른 대표작으로 꼽히는 『산소리』는 몽환 세계와 현실 세계의 귀로에 서서, 과거에 동경했던 연상의 여인에 대한 집요한 집착과 현실의 터부에 대한 과감한 도발이 차가울 정도로 차분히 전개되는 소설로, 가와바타 야스나리의 후기 대표작으로 꼽힌다. 해몽 소설이라 불러도 과언이 아닐 이 텍스트에서는 죽음에 대한 공포가 유머로 그려지는데 그 유머에는 읽는 이의 마음을 슬프게 하는 그런 차가움이 있다는 평가를 받고 있다.

그의 장편 소설 『고도(古都)』라는 작품은 아이 때 버려졌던 치에코는 양부모의 사랑을 받으며 행복하게 자랐지만 가슴속에 알 수 없는 외로움을 품고 있다. 아름다운 처녀로 자란 치에코는 축제의 밤, 홀로 신사에 참배를 갔다가 자신과 똑 닮은 나에코를 만나게 된다. 어릴 적 헤어진 쌍둥이 언니를 만나게 해달라고 기원했던 나에코는 치에코를 반가워하지만 치에코의 가슴에는 격정적인 파란이 인다. 한날한시 한배에서 태어났지만 신분이 다른 치에코와 나에코. 그 운명의 엇갈림이 고도(古都) 교토를 배경으로 애잔하게 펼쳐진다.

『여자라는 것』은 그가 쓴 여성을 위한 소설로서 변호사의 부인으로 여자의 이상형에 가까운 중년의 이치코. 그런 이치코를 동성애라도 할 듯이 흠모하면서도 이치코의 옛 애인과 남편을 유혹하는 사카에. 깊은 슬픔을 간직한 채 처음 시작하는 사랑에 불타오르는 다에코. 젊은 두 여성, 이들은 이치코를 흠모하면서 각자의 연애에 자신을 불태운다. 『여자라는 것』은 이들 세 여자의 다양한 행동과 심리적 갈등을 세밀하게 묘사한 작품이다. 불가사의한 여자들만의 심리상태와 여자의 슬픔을 훌륭하게 표현해낸 작품으로 각각의 등장인물들의 섬세한 심리묘사를 통해서 여자가 여자를 알아가는 공포, 여자가 모르는 여자의 고독과 자부심을 그려내 여자의 생명력을 날것 그대로 드러낸다.

저자의 다른 작품으로 단편집 『이즈의 무희』는 한 고등학교 학생이 훌쩍 여행을 떠나, 우연히 만난 놀잇패거리와 어울려 며칠간 같이 지내다 헤어지는 내용이 대략적인 줄거리이다. 제목인, 『이즈의 무희』는 새카맣고 숱많은 머리카락과 대조적인 작고 흰 얼굴에 마음이 설레던 놀이패의 젊은 여자가 알고보니 고작해야, 12-13살 남짓의 어린애에 지나지 않았다는 작은 에피소드에서 나왔다. 가와바타 야스나리의 또 다른 단편을 모은 『어머니의 첫사랑』은 어머니가 죽은 후 어머니의 첫사랑이었던 시야마에게 맡겨진 유키코가 시야마를 남몰래 연모하면서도 와카스기에게 시집을 간다는 내용으로 유키코의 이루어질 수 없는 사랑을 간결한 필체로 묘사해낸다."
9788937460661,작가 정보가 없습니다.
9788937460708,"러시아의 대문호이자 사실주의 희곡의 대가로 불리는 안톤 체호프(Антон П. Чехов, 1860∼1904)는 러시아 남부의 흑해 연안 항구 도시인 타간로크에서 태어났다. 아버지 파벨은 항구도시 타간로크에서 잡화점을 운영했다. 그는 자식들에게 새벽 기도와 성가대 활동을 강요했는데, 그것이 작가의 유년 시절의 지각(知覺)을 지배하게 된다. 중학교 때 아버지가 파산해 온 가족이 모스크바로 떠난 후 체호프는 타간로크에 혼자 남았다. 이때부터 체호프는 독립심과 가족 부양에 대한 책임 의식을 갖게 되었다.

어려서부터 스스로 학비를 벌며 공부하던 그는 고학으로 중등학교를 마친 뒤 1879년 모스크바대학 의학부에 입학했다. 재학 중에 가족을 부양하기 위하여 단편소설들을 쓰기 시작했고, 졸업 후 의사로 근무하면서 본격적인 문학 활동에 나섰다. ‘안토샤 체혼테’, ‘내 형의 아우’, ‘쓸개 빠진 남자’와 같은 필명으로 생계를 위해 유머 잡지에 글을 쓰기 시작했다. 그의 초기 단편들은 쉽게 읽을 수 있는 가벼운 소품들이 대부분이었다. 1885년 12월 체호프는 레이킨의 초대를 받아 페테르부르크로 가게 된다.

거기서 드미트리 바실리예비치 그리고로비치와 알렉세이 세르게예비치 수보린을 알게 된다. 1884년 의사 자격을 얻은 후 결핵을 앓는 와중에도 의료 봉사와 글쓰기를 병행하며 풍자와 유머가 담긴 뛰어난 작품을 많이 남겼다. 그리고로비치는 체호프의 『사냥꾼』을 읽으면서 그의 위대한 재능이 소모되는 것을 안타깝게 여겼다. 이 무렵 그에게 당대 최고의 작가 그리고로비치가 천재적인 재능을 낭비하지 말고 문학에 집중하라는 조언의 편지를 보내 온다.

이 충고 이후 1887년 봄 무렵부터 체호프는 이전과는 다른, 보다 객관적인 작가로 변모하게 된다. 한편으로 수보린은 체호프에게 고정 지면을 내주었고, 경제적 후원자가 되어 주었다. 그의 경제적 후원 덕택에 체호프는 원고 마감 시간과 주제의 제약과 같은 현실적 부담에서 벗어나 전업 작가로서의 길을 걷게 된다. 『황야』, 『지루한 이야기』, 『등불』 등을 발표하며 작가로서의 위치를 굳히게 되었고, 30세 때 시베리아 횡단 여행을 기점으로 사회문제를 주제로 한 작품을 많이 다루며 사회 활동에도 참여하였다.

이후 작가로서의 자각을 새로이 하여 단편집 『황혼』(1887)으로 푸슈킨상을 받고 희곡 『이바노프』(1887), 중편소설 『대초원』(1888)을 발표하며 그동안의 스타일에 작별을 고했다. 1890년에는 사할린 섬으로 가 당시 제정 러시아의 유형 제도를 면밀히 관찰하고 이에 관한 르포르타주 『사할린 섬』(1895)을 발표한다. 이 작품은 대중의 엄청난 주목을 받았으며, 사할린에서 만난 하층민 유형수들과 정부 제도의 부조리는 이후 발표되는 그의 작품이 민중의 삶에 더욱 밀착하는 계기가 되었다.

1892년 모스크바 근교의 멜리호보에 정착한 작가는 왕성한 창작열로 『6호실』(1892), 『문학 선생』(1889∼1894), 『롯실트의 바이올린』(1894), 『대학생』(1894), 『3년』(1895), 『다락이 있는 집』(1896), 『나의 삶』(1896), 『갈매기』(1896), 『농군들』(1897)과 같은 후기 걸작들을 집필했다.

한편으로 농민들을 무료로 진료하고, 톨스토이, 코롤렌코와 함께 기근(饑饉)과 콜레라 퇴치 자선사업을 펼쳤으며, 학교와 병원 건립 등 사회사업에도 참여했다. 1898년 지병인 결핵이 악화되어 크림 반도의 얄타로 이사한 체호프는 우울과 고독 속에서 나날을 보냈는데, 모스크바 예술극장 여배우 올가 크니페르와의 결혼으로 ‘새로운 삶’에 대한 희망을 갖게 된다. 이 시기에 그는 『용무가 있어서』(1899), 『사랑스러운 여인』(1899), 『개를 데리고 다니는 부인』(1899), 『바냐 외삼촌』(1899), 『골짜기에서』(1900), 『세 자매』(1901), 『약혼녀』(1903) 등을 발표했다.

1904년 1월 17일 체호프의 생일에 초연된 [벚나무 동산]과 창작 25주년 축하연은 그에게 무한한 기쁨을 주었지만, 그의 건강은 회복할 수 없을 정도로 악화되었다. 같은 해 6월 독일 바덴베일레르(Баденвейлер)로 아내 올가 크니페르와 요양을 떠나 거기서 생을 마감했다."
9788937460753,"미국의 소설가이며 단편 작가이다. 양차 세계대전 사이의 시기, 그중에서도 1920년대 화려하고도 향락적인 재즈 시대를 배경으로 무너져 가는 미국의 모습과 ‘로스트제너레이션’의 무절제와 환멸을 그린 작가다. 어니스트 헤밍웨이, 윌리엄 포크너 등과 함께 20세기 초 미국 문학을 대표하는 작가로, 작품과 생애, 스타일 등 모든 면에서 재즈 시대를 대표하는 하나의 아이콘이 된 인물이다. 1896년 9월 24일 미네소타 주 세인트폴에서 태어났다. 프린스턴 대학에 입학했으나 성적 부진으로 자퇴 후, 군에 입대하여 제1차 세계대전에 참전하였다. 1919년 장편소설 『낙원의 이쪽』을 발표하여 큰 성공을 거두었다.

1925년 4월, 피츠제럴드는 장편소설 『위대한 개츠비』를 완성했는데, 1920년대 대공황 이전 호황기를 누리던 미국의 물질 만능주의 속에서 전후의 공허와 환멸로부터 도피하고자 향락에 빠진 로스트제너레이션의 혼란을 예리하게 포착하고 있다. 작품에서 청춘의 욕망과 절망이 절묘하게 묘사되고 있다. 세계적인 명작으로 연극, 영화, 뮤지컬 등 다양한 매체에서 다루고 있다.

헤밍웨이는 “이토록 좋은 작품을 쓸 수 있다면, 앞으로 이보다 더 뛰어난 작품을 얼마든지 쓸 수 있다.”라며 작품에 대해 찬사를 보냈다. T. S. 엘리엇은 “헨리 제임스 이후 미국 소설이 내디딘 첫걸음”이라고, 거트루드 스타인은 “(피츠제럴드는) 이 소설로 동시대를 창조했다.”라고 극찬했다. 그러나 이 작품은 데뷔작 『낙원의 이쪽』의 절반도 팔리지 않았고, 오히려 그가 죽은 후 재조명되어 전 세계적인 베스트셀러가 되었다.

대표적인 작품들로는 장편소설로 『밤은 부드러워』, 『마지막 거물의 사랑(미완)』, 『말괄량이와 철학자들』, 『낙원의 이쪽』, 『아름답고도 저주받은 사람들』, 『재즈 시대의 이야기들』, 『위대한 개츠비』, 『얼음 궁전』, 『밤은 부드러워』, 『기상나팔 소리』등을 비롯해 중단편 160여 편을 남기고 1940년 12월 21일 44세의 나이로 사망했다."
