9791136278630,"일본 추리소설계를 대표하는 최고의 베스트셀러 작가. 추리소설 분야에서 특히 인정받고 있는 그는 누구도 상상하지 못한 소재를 자유자재로 변주하는 능력을 가진 탁월한 이야기꾼이다. 그의 작품은 치밀한 구성과 대담한 상상력, 속도감 있는 스토리 전개로 처음부터 끝까지 팽팽한 긴장감을 유지해 독자를 잠시도 방심할 수 없게 만든다. 일본을 대표하는 소설가이자 최고의 베스트셀러 작가가 된 히가시노 게이고는 첫 작품 발표 이후 20년이 조금 넘는 작가 생활 동안 35편이라는 많은 작품들을 써냈음에도 불구하고 늘 새로운 소재, 치밀한 구성과 날카로운 문장으로 매 작품마다 높은 평가를 얻고 있다.

1958년 2월 4일 오사카에서 태어나 오사카 부립대학 전기공학과를 졸업했다. 곧바로 일본 전자회사인 '덴소사'에 입사해 엔지니어로 활동하며 틈틈이 소설을 쓴 특이한 이력을 가지고 있다. 1985년 『방과후』로 제31회 에도가와 란포 상을 수상했고 이를 계기로 전업작가가 되었다. 이공계 출신이라는 그의 특이한 이력은 『게임의 이름은 유괴』에서도 인터넷의 무료메일, 게시판, 불법 휴대전화, FAX, 비디오 카메라 등 하이테크 장비를 이용해 무사히 몸값을 받아내고 유괴를 성공해내는 장면을 사실적으로 묘사하는데 큰 도움이 되었다. 이과적 지식을 바탕으로 기발한 트릭과 반전이 빛나는 본격 추리소설부터 서스펜스, 미스터리 색채가 강한 판타지 소설에 이르기까지 폭넓은 장르의 작품들을 꾸준히 발표해왔다. 이 중 상당수의 작품이 영화와 텔레비전 드라마로 제작되어 큰 사랑을 받았다.

에도가와 란포 상은 그 해의 가장 우수한 추리 작품에 수여되는 상으로 데뷔작이자 수상작인 『방과후』로 화려하게 등단한 그는 일본 내에서 매우 높은 평가를 받는 작가이지만, 유독 한국에서 그 명성과 실력에 맞는 인지도를 쌓지는 못하고 있는 것이 현실이었다. 하지만 1999년 제52회 일본추리작가협회상을 수상한 『비밀』을 계기로 우리 나라 독자들에게도 가까워지게 되었다. 엄마의 영혼이 딸에게 빙의된다는 다소 충격적인 소재를 다루었다. 이 작품은 청순한 이미지로 한국에서도 인기가 높은 히로스에 료코 주연으로 영화화되어 한국에서도 많은 사랑을 받은 바 있다.

그의 소설은 치밀한 구성과 속도감 있는 스토리 전개, 예상치 못한 반전으로 마지막 페이지를 넘길 때까지 독자를 방심할 수 없게 만든다. 또한 빙의나 의료 사고 등 녹록치 않은 소재를 능수능란하게 다루며 당대 첨예한 사회 문제를 수면 위로 끌어올려 추리소설에 국한되지 않은 다양한 소설을 쓰고 있다. 늘 새로운 소재와 치밀한 구성, 생생한 문장으로 매번 높은 평가를 받는 저력 있는 작가인 그는 일본을 대표하는 소설가답게 작품 중 19편이 영화와 드라마로 다시 독자들과 관객들을 만났다. 이제는 한국에서도 가장 사랑받는 작가 중 하나로 꼽히며, 전세계적 팬덤을 형성하고 있다.

데뷔작 이후 20년이 넘는 작가 생활 동안 50편이 넘는 작품을 써내면서도 자신의 사생활을 절대 밝히지 않는 '비밀'의 작가 히가시노 게이고. 그는 독자들에게 자신을 드러내지 않으면서도 퀄리티 높은 다작의 작품과 한 장의 사진이 남긴 강한 인상으로 스타성을 보여주는 독특한 작가로, 20세기 중반의 하드보일드 소설과는 완전히 다른 형태의 드라이한 문체는 극명하게 사건과 행위 위주의 전개 방식을 지향한다. 감정은 휘발되고, 독자들은 등장인물과 함께 다음 퍼즐의 조각을 찾아 매 페이지를 바쁘게 내달려야 한다. 결과적으로 종종 '읽는 엔터테인먼트'로서의 소재주의라는 함정에 빠지기도 하지만, 그만큼이나 동시대의 현실 감각을 놓치지 않는 재능에 감탄하게끔 만들어버린다.

현재 전업 작가로 도쿄 중심가의 한 맨션에서 ""가족이자 나를 비추는 거울이며 교사이기도 한 위대한 존재""인 네코짱(고양이)을 부양하며 살고 있다. 그의 삶에는 '술시'라는 독특한 시간이 있는데, 밤 11시부터 잠들기 전까지는 혼자 또는 벗들과 술을 마시는 시간을 정해놓은 것이다. 시계수리공이었던 부친이 늦은 밤까지 일을 끝내고 ""아아, 오늘은 여기까지 해냈군"" 하면서 혼자 술을 마시는 모습이 행복해 보였다고 한다. 그래서 지금도 마감을 끝내면 이모쇼추(고구마소주)를 마시면서, ""그래, 그 대목은 그걸로 괜찮겠지"", ""아휴, 거긴 고쳐 쓰는 게 좋았을걸"" 하며 되돌아본다. 때로는 도쿄 긴자의 바 '문단'을 찾는다. 다양한 업계 사람들을 접하면서 현실 감각을 얻는 곳이며, 편집자들을 만나 인물과 이야기 전개 방향을 논하기도 한다.

『비밀』로 1999년 제52회 일본추리작가협회상을 수상했으며, 2006년 초에는 『용의자 X의 헌신』으로 제134회 나오키상과 제6회 본격미스터리대상 소설부문상을 수상하는 영광을 안았다. 2012년 『나미야 잡화점의 기적』으로 제7회 중앙공론문예상, 2013년 『몽환화』로 제26회 시바타렌자부로상, 2014년 『기도의 막이 내릴 때』로 제48회 요시카와에이지문학상을 수상했다. 이제까지 나오키 상에 『비밀』, 『백야행』, 『짝사랑』(片想い), 『편지』(手紙), 『환야』(幻夜)등 다섯 작품이 후보로 추천받은 바 있으나 전부 낙선하여, 나오키 상과는 인연이 없는 남자라고 불리기도 했지만 여섯 번째 추천작 『용의자 X의 헌신』으로 결국 상을 거머쥐게 되었다. 2012년 『나미야 잡화점의 기적』으로 중앙공론 문예상을, 2013년 『몽환화』로 시바타 렌자부로상을 수상했으며, 2014년에는 『기도의 막이 내릴 때』 로 요시카와 에이지 문학상을 수상했다.

『아들 도키오』는 식물인간이 된 아들 ‘도키오’의 영혼이 과거로 날아가, 젊은 시절의 아버지와 만나 벌어지는 이야기를 담고 있다. 타임슬립이라는 SF적 발상부터, 실종과 추적을 넘나드는 스릴과 미스터리, 삶에 대한 긍정과 부자간의 사랑이라는 뭉클한 감동까지 히가시노 게이고의 모든 매력이 한 권에 압축된 작품이라 평가받는다. 2002년 첫 출간 이후 밀리언셀러를 기록하며 히가시노 게이고의 팬이라면 꼭 읽어야 할 책으로 첫손에 꼽히고 있다.

『하쿠바산장 살인사건』은 ‘가가 형사’ 시리즈를 제외하고 데뷔 이후 두 번째로 발표한 장편소설이다. 1986년에 발표한 작품이라고는 믿을 수 없을 정도로 밀실 트릭, 암호, 연쇄살인 등을 교묘하게 얽어낸 상상력이 돋보이며, 정통 추리소설이 가진 장점을 극대화한 작품이다. 『숙명』은 1993년 발매되었으며, 히가시노 게이고의 무르익은 필력을 확인할 수 있는 미스터리 명작으로, 이 작품을 꾸준히 찾는 독자들의 성원에 힘입어 금번 새로이 재출간되었다.

『회랑정 살인사건』은 1991년에 출간된 이후, 일본에서 드라마로 방영되는 등 꾸준히 사랑받으면서 약 30년 동안 스테디셀러로 자리 잡았다. 자본주의로 인한 폐해와 외모 지상주의를 소재로 한 초기 대표작으로, 사회악과 부조리를 선명하게 고발해 내는 작가의 저력을 확인할 수 있는 작품이다.

주요 작품으로는 『방황하는 칼날』, 『흑소소설』, 『독소소설』, 『괴소소설』, 『레몬』, 『환야』, 『11문자 살인사건』, 『게임의 이름은 유괴』, 『호숫가 살인사건』, 『브루투스의 심장』, 『한여름의 방정식』, 『몽환화』, 『그 무렵 누군가』, 『가면 산장 살인 사건』, 『인어가 잠든 집』, 『살인의 문』, 『백야행』, 『기린의 날개』, 『한여름의 방정식』, 『신참자』, 『탐정 갈릴레오』, 『예지몽』, 『다잉 아이』, 『뻐꾸기 알은 누구의 것인가』, 『학생가의 살인』, 『오사카 소년 탐정단』, 『천공의 벌』, 『붉은 손가락』 등이 있다. 『방과 후』, 『쿄코의 꿈』, 『거울의 안』, 『기묘한 이야기』, 『숙명』, 『백야행』, 『갈릴레오』등 지금까지 20편이 넘는 작품들이 드라마로 제작되었으며 『비밀』, 『변신』, 『편지』,『용의자 X의 헌신』, 『더 시크릿』등 10여편이 영화로 제작되는 등, 대중들에게 큰 사랑을 받고 있다."
9791136279217,"아이치 현 나고야 시에서 애묘 ‘냥코’와 알콩달콩한 동거 중인 부부 일러스트레이터. 디스플레이회사를 다니던 2002년, 직장 생활을 청산하고 야심차게 독립을 선언했다. 전자출판DTP 오퍼레이터로 활동하던 중 일러스트 작업 의뢰가 점점 많아지면서 자연스럽게 ‘일러스트레이터’가 직업이 되었다. 많은 애묘가의 공감을 모은 첫 번째 만화책 『콩고양이』시리즈로 인기를 모았으며, 『아기 고양이 동그리』, 『시바 아저씨』, 『고양이의 속마음』, 『고양이와 할아버지』, 『약이 되는 밥』등 다수의 저서가 국내에 출간되었다."
9791136279408,작가 정보가 없습니다.
9791136401212,출간작 『나 혼자만 레벨업』
9791136401250,출간작 『나 혼자만 레벨업』
9791136401267,출간작 『나 혼자만 레벨업』
9791136401274,출간작 『나 혼자만 레벨업』
9791136401281,출간작 『나 혼자만 레벨업』
9791136724311,작가 정보가 없습니다.
9791136734518,작가 정보가 없습니다.
9791136735546,"군마 현 타카사키 시 출신, 도쿄 네리마 구 거주. 2002년부터 쿠노리 후미오(九里史生)라는 펜네임으로 자신의 웹 사이트에 온라인 소설을 연재하기 시작했다. 2008년 웹 사이트에 연재하고 있던 「초절가속 버스트링커」의 제목을 「액셀 월드」로 고쳐 제15회 전격 소설 대상에 응모해 대상에 입상, 2009년 2월에 수정을 가해서 문고본을 출판하였다. 같은 해 4월에는 웹 사이트에 연재하던 「소드 아트 온라인」도 출판, 발행 중이다. 『액셀 월드』는 2012년 4월, 『소드 아트 온라인』은 2012년 7월에 현지 애니메이션이 제작됐다."
9791136735638,작가 정보가 없습니다.
9791136739964,"일본의 소설가로 오오이타현 출신이다. 대학 졸업 후 몇 년간 자전거 수입 회사에 근무하였으나, 전철을 타고있을 때 갑자기 작가가 되고자 마음먹고 퇴직을 하였다. 1998년 「콜드지옥」으로 제5회 전격소설대상에서 은상을 수상하며 데뷔하였다. 1999년 「M.G.H」로 제1회 일본SF신인상을, 「어스리버스」로 제5회 스니커즈대상에서 특별상을 수상하였다. 현재 일본 SF작가클럽 일본추리 작가협회에 소속되어있으며, 본격 미스터리 작가 클럽의 회원이다."
9791138000598,작가 정보가 없습니다.
9791138000611,작가 정보가 없습니다.
9791138002349,13세 무렵 라이트노벨 《바람에 선 'D'》를 읽고 작가를 지망했다. 대학재학 중 《앙화봉신TCG(央華封神TCG》의 제작에 관여했으며 상업지 활동을 개시해 《몬스터 컬렉션 단편집》에 소설을 게재했다. 대표작 :《렌탈 마법사》《크로스×레가리아》 등
9791138002387,작가 정보가 없습니다.
9791138003278,"일본의 시나리오 라이터이자 만화 원작자, 라이트노벨 작가이다. 자동차회사에 근무하는 평범한 직장인이였으나 퇴직을 미루어 오던 중 2012년 초 퇴직 후, 자신이 원하는 분야인 시나리오 관계의 취업 준비를 하면서 동영상 게시물을 제작하였다. 그렇게 제작되어 니코니코동화에서 발표된 동영상 「ゆっくり妖夢と本當はこわいクトゥルフ神話」이 큰 화제를 불러일으켜 ""월간 소년 에이스""에서 스카웃을 받게 된다. 협의 후,「문호 스트레이독스」로 상업데뷔하게 되었다."
9791138003315,작가 정보가 없습니다.
9791138003322,작가 정보가 없습니다.
9791138003339,https://twitter.com/nezumiironyanko
9791138400381,"2014년에 작품 활동 20주년을 맞이한 대가. 대표작으로 <슈퍼 러버즈>, <넌 날 좋아하게 될 거야> , <팔견전? 동방팔견이문> 등이 있다. 이중 <팔견전 - 동방팔견이문> 은 애니메이션 및 뮤지컬로도 제작되었다."
9791138400428,"일본 추리소설계를 대표하는 최고의 베스트셀러 작가. 추리소설 분야에서 특히 인정받고 있는 그는 누구도 상상하지 못한 소재를 자유자재로 변주하는 능력을 가진 탁월한 이야기꾼이다. 그의 작품은 치밀한 구성과 대담한 상상력, 속도감 있는 스토리 전개로 처음부터 끝까지 팽팽한 긴장감을 유지해 독자를 잠시도 방심할 수 없게 만든다. 일본을 대표하는 소설가이자 최고의 베스트셀러 작가가 된 히가시노 게이고는 첫 작품 발표 이후 20년이 조금 넘는 작가 생활 동안 35편이라는 많은 작품들을 써냈음에도 불구하고 늘 새로운 소재, 치밀한 구성과 날카로운 문장으로 매 작품마다 높은 평가를 얻고 있다.

1958년 2월 4일 오사카에서 태어나 오사카 부립대학 전기공학과를 졸업했다. 곧바로 일본 전자회사인 '덴소사'에 입사해 엔지니어로 활동하며 틈틈이 소설을 쓴 특이한 이력을 가지고 있다. 1985년 『방과후』로 제31회 에도가와 란포 상을 수상했고 이를 계기로 전업작가가 되었다. 이공계 출신이라는 그의 특이한 이력은 『게임의 이름은 유괴』에서도 인터넷의 무료메일, 게시판, 불법 휴대전화, FAX, 비디오 카메라 등 하이테크 장비를 이용해 무사히 몸값을 받아내고 유괴를 성공해내는 장면을 사실적으로 묘사하는데 큰 도움이 되었다. 이과적 지식을 바탕으로 기발한 트릭과 반전이 빛나는 본격 추리소설부터 서스펜스, 미스터리 색채가 강한 판타지 소설에 이르기까지 폭넓은 장르의 작품들을 꾸준히 발표해왔다. 이 중 상당수의 작품이 영화와 텔레비전 드라마로 제작되어 큰 사랑을 받았다.

에도가와 란포 상은 그 해의 가장 우수한 추리 작품에 수여되는 상으로 데뷔작이자 수상작인 『방과후』로 화려하게 등단한 그는 일본 내에서 매우 높은 평가를 받는 작가이지만, 유독 한국에서 그 명성과 실력에 맞는 인지도를 쌓지는 못하고 있는 것이 현실이었다. 하지만 1999년 제52회 일본추리작가협회상을 수상한 『비밀』을 계기로 우리 나라 독자들에게도 가까워지게 되었다. 엄마의 영혼이 딸에게 빙의된다는 다소 충격적인 소재를 다루었다. 이 작품은 청순한 이미지로 한국에서도 인기가 높은 히로스에 료코 주연으로 영화화되어 한국에서도 많은 사랑을 받은 바 있다.

그의 소설은 치밀한 구성과 속도감 있는 스토리 전개, 예상치 못한 반전으로 마지막 페이지를 넘길 때까지 독자를 방심할 수 없게 만든다. 또한 빙의나 의료 사고 등 녹록치 않은 소재를 능수능란하게 다루며 당대 첨예한 사회 문제를 수면 위로 끌어올려 추리소설에 국한되지 않은 다양한 소설을 쓰고 있다. 늘 새로운 소재와 치밀한 구성, 생생한 문장으로 매번 높은 평가를 받는 저력 있는 작가인 그는 일본을 대표하는 소설가답게 작품 중 19편이 영화와 드라마로 다시 독자들과 관객들을 만났다. 이제는 한국에서도 가장 사랑받는 작가 중 하나로 꼽히며, 전세계적 팬덤을 형성하고 있다.

데뷔작 이후 20년이 넘는 작가 생활 동안 50편이 넘는 작품을 써내면서도 자신의 사생활을 절대 밝히지 않는 '비밀'의 작가 히가시노 게이고. 그는 독자들에게 자신을 드러내지 않으면서도 퀄리티 높은 다작의 작품과 한 장의 사진이 남긴 강한 인상으로 스타성을 보여주는 독특한 작가로, 20세기 중반의 하드보일드 소설과는 완전히 다른 형태의 드라이한 문체는 극명하게 사건과 행위 위주의 전개 방식을 지향한다. 감정은 휘발되고, 독자들은 등장인물과 함께 다음 퍼즐의 조각을 찾아 매 페이지를 바쁘게 내달려야 한다. 결과적으로 종종 '읽는 엔터테인먼트'로서의 소재주의라는 함정에 빠지기도 하지만, 그만큼이나 동시대의 현실 감각을 놓치지 않는 재능에 감탄하게끔 만들어버린다.

현재 전업 작가로 도쿄 중심가의 한 맨션에서 ""가족이자 나를 비추는 거울이며 교사이기도 한 위대한 존재""인 네코짱(고양이)을 부양하며 살고 있다. 그의 삶에는 '술시'라는 독특한 시간이 있는데, 밤 11시부터 잠들기 전까지는 혼자 또는 벗들과 술을 마시는 시간을 정해놓은 것이다. 시계수리공이었던 부친이 늦은 밤까지 일을 끝내고 ""아아, 오늘은 여기까지 해냈군"" 하면서 혼자 술을 마시는 모습이 행복해 보였다고 한다. 그래서 지금도 마감을 끝내면 이모쇼추(고구마소주)를 마시면서, ""그래, 그 대목은 그걸로 괜찮겠지"", ""아휴, 거긴 고쳐 쓰는 게 좋았을걸"" 하며 되돌아본다. 때로는 도쿄 긴자의 바 '문단'을 찾는다. 다양한 업계 사람들을 접하면서 현실 감각을 얻는 곳이며, 편집자들을 만나 인물과 이야기 전개 방향을 논하기도 한다.

『비밀』로 1999년 제52회 일본추리작가협회상을 수상했으며, 2006년 초에는 『용의자 X의 헌신』으로 제134회 나오키상과 제6회 본격미스터리대상 소설부문상을 수상하는 영광을 안았다. 2012년 『나미야 잡화점의 기적』으로 제7회 중앙공론문예상, 2013년 『몽환화』로 제26회 시바타렌자부로상, 2014년 『기도의 막이 내릴 때』로 제48회 요시카와에이지문학상을 수상했다. 이제까지 나오키 상에 『비밀』, 『백야행』, 『짝사랑』(片想い), 『편지』(手紙), 『환야』(幻夜)등 다섯 작품이 후보로 추천받은 바 있으나 전부 낙선하여, 나오키 상과는 인연이 없는 남자라고 불리기도 했지만 여섯 번째 추천작 『용의자 X의 헌신』으로 결국 상을 거머쥐게 되었다. 2012년 『나미야 잡화점의 기적』으로 중앙공론 문예상을, 2013년 『몽환화』로 시바타 렌자부로상을 수상했으며, 2014년에는 『기도의 막이 내릴 때』 로 요시카와 에이지 문학상을 수상했다.

『아들 도키오』는 식물인간이 된 아들 ‘도키오’의 영혼이 과거로 날아가, 젊은 시절의 아버지와 만나 벌어지는 이야기를 담고 있다. 타임슬립이라는 SF적 발상부터, 실종과 추적을 넘나드는 스릴과 미스터리, 삶에 대한 긍정과 부자간의 사랑이라는 뭉클한 감동까지 히가시노 게이고의 모든 매력이 한 권에 압축된 작품이라 평가받는다. 2002년 첫 출간 이후 밀리언셀러를 기록하며 히가시노 게이고의 팬이라면 꼭 읽어야 할 책으로 첫손에 꼽히고 있다.

『하쿠바산장 살인사건』은 ‘가가 형사’ 시리즈를 제외하고 데뷔 이후 두 번째로 발표한 장편소설이다. 1986년에 발표한 작품이라고는 믿을 수 없을 정도로 밀실 트릭, 암호, 연쇄살인 등을 교묘하게 얽어낸 상상력이 돋보이며, 정통 추리소설이 가진 장점을 극대화한 작품이다. 『숙명』은 1993년 발매되었으며, 히가시노 게이고의 무르익은 필력을 확인할 수 있는 미스터리 명작으로, 이 작품을 꾸준히 찾는 독자들의 성원에 힘입어 금번 새로이 재출간되었다.

『회랑정 살인사건』은 1991년에 출간된 이후, 일본에서 드라마로 방영되는 등 꾸준히 사랑받으면서 약 30년 동안 스테디셀러로 자리 잡았다. 자본주의로 인한 폐해와 외모 지상주의를 소재로 한 초기 대표작으로, 사회악과 부조리를 선명하게 고발해 내는 작가의 저력을 확인할 수 있는 작품이다.

주요 작품으로는 『방황하는 칼날』, 『흑소소설』, 『독소소설』, 『괴소소설』, 『레몬』, 『환야』, 『11문자 살인사건』, 『게임의 이름은 유괴』, 『호숫가 살인사건』, 『브루투스의 심장』, 『한여름의 방정식』, 『몽환화』, 『그 무렵 누군가』, 『가면 산장 살인 사건』, 『인어가 잠든 집』, 『살인의 문』, 『백야행』, 『기린의 날개』, 『한여름의 방정식』, 『신참자』, 『탐정 갈릴레오』, 『예지몽』, 『다잉 아이』, 『뻐꾸기 알은 누구의 것인가』, 『학생가의 살인』, 『오사카 소년 탐정단』, 『천공의 벌』, 『붉은 손가락』 등이 있다. 『방과 후』, 『쿄코의 꿈』, 『거울의 안』, 『기묘한 이야기』, 『숙명』, 『백야행』, 『갈릴레오』등 지금까지 20편이 넘는 작품들이 드라마로 제작되었으며 『비밀』, 『변신』, 『편지』,『용의자 X의 헌신』, 『더 시크릿』등 10여편이 영화로 제작되는 등, 대중들에게 큰 사랑을 받고 있다."
9791138400855,"『너의 췌장을 먹고 싶어』로 주목을 받으며 일본 문단에 등장한 신인 작가. 집필 활동은 고등학생 시절부터 시작했다. 2014년 2월 ‘요루노 야스미’라는 필명으로 투고 웹사이트 [소설가가 되자]에 올린 원고 『너의 췌장을 먹고 싶어』가 어마어마한 인기를 끌었고 이후 책으로 출간되며 소설가로 데뷔했다.

『너의 췌장을 먹고 싶어』는 처음에는 기발한 제목으로 눈길을 끌었지만 만개한 벚꽃 앞에 서 있는 고등학생 남녀를 주인공으로 쓴 섬세한 청춘물이며 전혀 예상하지 못한 결말이 감성을 자극한다는 것이 더 화제가 되어 베스트셀러에 올랐다.

2016년 『너의 췌장을 먹고 싶어』로 서점 대상 2위에 올랐으며 일본의 각종 출판 집계에서 1,2위를 기록했다. 소설은 영화로도 제작되어 2017년 여름, 개봉이 확정되었다. 다른 작품으로는 『또 같은 꿈을 꾸고 있었다』, 『밤의 괴물』이 있다."
9791155351406,"박범신, 공지영, 황현산 등 심사위원들의 만장일치로 제15회 한겨레문학상에 당선된 작가. 1981년 눈이 많이 내리던 날 서울에서 태어났다. 유년기에 이사를 자주 다녀서 어딜 가도 내 집, 내 고향 같다. 소설가가 되겠다고 생각한 적은 없지만 소설은 쓰고 싶었다. 낮엔 일하고 밤엔 글 쓰다가 2006년 [실천문학]으로 등단했다. 등단 2년 후부터 낮엔 글 쓰고 밤엔 푹 잤다. 다음 생엔 적은 돈으로도 우주여행이 가능한 시대 혹은 행성에 태어나고 싶다. 은근히 열정적으로, 다음 생의 우주를 치밀하게 준비 중이다.

소설집 『팽이』, 『겨울방학』, 장편소설 『당신 옆을 스쳐간 그 소녀의 이름은』, 『끝나지 않는 노래』, 『나는 왜 죽지 않았는가』, 『구의 증명』, 『해가 지는 곳으로』, 『이제야 언니에게』, 『내가 되는 꿈』, 『팽이』, 『겨울방학』 등을 썼다. 앤솔러지 『장래 희망은 함박눈』을 함께 썼다. 만해문학상, 백신애문학상, 신동엽문학상, 한겨레문학상 등을 수상했다."
9791155813508,작가 정보가 없습니다.
9791156291275,"본명 노정남. 강원도 원주에서 태어났다. 2021년 [문학나무]로 등단하였다. 현 외국인회사 ㈜애큐랩에서 근무하고 있다. 율목독서회, 가톨릭문인협회, 공간시 낭독회의 회원으로활동하고 있다. 시집 『나뭇잎 물고기』를 썼다."
9791156756552,"2016년을 뒤흔든 『죽여 마땅한 사람들』로 “메스처럼 예리한 문체로 냉정한 악의 본질을 탐구하는 작가 [퍼블리셔스 위클리]”, “무시무시한 미치광이에게 푹 빠져들게 하는 법을 아는 작가[더 가디언]” 라는 찬사를 받았다. “대담하고 극적인 반전을 갖춘 채 가차 없이 펼쳐지는 이야기[보스턴 글로브]”라는 평가를 받은 『아낌없이 뺏는 사랑』으로 ‘결코 독자를 실망시키지 않는 작가’로 확고히 자리 잡았다. 한국에서 세 번째로 출간된 작품 『312호에서는 303호 여자가 보인다』는 건물의 독특한 구조가 이야기에 중요한 역할을 하는 ‘아파트먼트 스릴러’로, 색다른 공간이 자아내는 긴장감과 서스펜스가 압도적이다."
