ISBN13,review
9791130637617,"“어른으로 사느라 힘들었죠?”


우리는 모두 미완성인 상태로 살아간다. '미생'이라는 말이 괜히 나왔을까? 우리는 늘 불안한 상태로, 외로운 상태로 이 세상을 살아간다. 이 책은 그런 우리의 자화상을 보여주는 소설인 것 같다. 그 외로움은 잠시 잊으라고, 다들 불안하게 살아간다고 말하며 위로해 주는 소설.


이 책은 세계적인 소설가 프레드릭 베크만이 3년 만에 낸 신작으로, 코로나로 외로움을 겪는 이들에게 유쾌한 웃음을 선사하다. 역시 베크만이라는 말이 절로 나오는 이야기. 인질범이 된 은행강도인 주인공과 아파트 오픈 하우스에게 갔다가 얼떨결에 인질이 되어버린 8명의 사람들이 등장한다.


이상한 상황에서 만난 그들은 모두 공통점을 갖고 있다. 어른이지만, 불안한 요소를 하나씩 안고 살아가는 어른인척 하는 어른들이라는 것. 나름의 이유는 다들 다르다. 좋은 부모가 되지 못할까봐, 혹은 좋은 배우자가 되지 못할까봐 등등의 이유로 그들은 불안해한다. 작가는 그들의 불안을 하나씩 짚어가며 다독여 주고 그들을 안아주고 이해한다.


중간중간 보여주는 웃음코드는 전세계인에게 통했다. 전 세계 280만부의 판매고를 올리는 것은 물론이고, 뉴욕타임스 베스트셀러1위 자리를 77주간 지키고, 지금은 톰 행크스 주연의 영화화를 앞두고 있을만큼 많은 이들에게 사랑받고 있다.


그의 작품은 간간히 읽고 있는데, 그 특유의 따뜻함이 묻어나와 애정하는 작가 중 하나이다. 그의 소설은 관계를 중시하는데 있지 않나 생각될 만큼 사람들간의 관계를 중심으로 이야기가 전개되며 결국 '사람'이라는 말로 귀결된다고 봐도 무방할 것 같다. 결국 그를 좋아하는 많은 이들이 그의 따뜻함에 반했다고해도 과언이 아니지않을까 생각이 든다. 이번 소설 역시 마찬가지이다. 유쾌하게 웃고 싶거나, 따뜻함이 그리운 사람이라면 꼭 한번 보길 바란다.


'진실. 세상에 진실은 없다. 우리가 우주의 경계에 대해 어찌어찌 알아낸 게 있다면 우주에는 경계가 없다는 것뿐이고, 신에 대해 아는 게 있다면 우리는 아무것도 모른다는 것뿐이다.' <책 속에서...>"
9791130637617,"역시 기대를 저버리지 않네요…
처음엔 인질극, 은행강도 이야기인줄 만 알았는데…
뜻밖의 다리…전개…우스꽝스럽지만…바보같지 않은
사람들의 이야기…
역시 배크만의 전작들처럼 일상에서의 감동을 주네요
오랜만에 재밌고 유쾌하지만…안타깝고…
감동적인 소설 한편 뚝~딱 읽었습니다.
다음 작품도 빨리 나왔으면 좋겠네요~
역시 믿고 읽는 작가 프레드릭배크만"
9791130637617,"오베라는 남자로 저의 마음을 사로 잡았던 프레드릭 베커만의 신작이 3년만에 나와서 보자마자 구매해서 익었습니다. 500페이지 책이 50페이지 같은 착각이 들 정도로 재미있는 책이라는 생각이 들었습니다. 
바보 같이 웃긴 인질과 은행강도가 나오는데 어쩌다 은행 강도가 된 여자와 어쩌다 인질이 된 사람들, 그 사건을 해결하기 위해 투입된 경찰들의 이야기입니다. 어설프고 바보같고 불안에 쌓인 사람들이 등장하는데 줄거리의 흐름이 우리가 생각했던 것을 넘어서 그만의 독특한 상상력 속 속으로 빠져들게 됩니다.
  이 시대를 살고 있는 사람들에게 경제적인 어려움, 자녀 양육에 대한 두려움, 부모와 자녀와의 관계 모든것들이 불안한 마음으로 시작하는 하루하루에 나를 감정 이입해서 재미있게 읽을 수 있는 작품이었습니다. "
9791130637617,"[해당 서평은 다산북스의 서평단활동으로 작성됐습니다]
  스웨덴을 배경으로 일어나는 어떤 사건에 관한 책이다.
첫 장부터 등장인물들에 대한 설명이 있길래
뭔가 하고 유심히 봤는데
  첫 장부터 사건이 일어나게 된 배경이나 상황설명 없이
경찰과 목격자들의 진술이 이어지기 때문에
등장인물들의 설명을 유심히 보고 책을 읽는것이 좋을듯하다.
  서로 관련없어 보이는 내용들이 이어지고
시간 순서도 없이
이 얘기했다가 다시 관련있는 과거의 시간대를 서술하고
'지금 이 사건이 생기게 된 이유에는 알고보면 과거의 한 사건이 직접적인 연관이 있었다'
라는 것도 바로 알려주지 않고
책을 한 줄 한 줄 읽어나가면서 독자들이 스스로 깨닫게 하는 구성 자체가
'나미야잡화점의 기적'과 비슷하다고 느끼면서 읽었다.
책을 다 읽고보니 토끼가 그림과 피자를 들고 폭죽을 구경하는 표지가
전혀 이상하지 않고 감동적으로 다가온다
제목인 '불안한 사람들'답게 PTSD 나 공황장애를 가진 등장인물들이 많이 나온다.
책의 마지막인 작가의 말에서 본인도 공황장애로 심리 치료사와 상담가를 몇 년간 만나고 있다는 얘기를 듣고
더 마음에 가깝게 다가왔다.
결국 사람에 관한 상처는 사람이 치료해준다는 것을 알게됐고
두 가지 사건을 여러 시간대와 여러 시각에서 보여주며
씨줄과 날줄처럼 촘촘히 엮은 이야기가 펼쳐진다.
역시 '오베라는 남자'에서 검증받은 작가라 그런가 필력이 남달랐다."
9791130637617,"(* 이 글은 다산북스에서 진행하는 서평단 활동으로 작성되었습니다.)
프레드릭 배크만의 책 중에서 저는 <베어타운>을 굉장히 인상 깊게 읽었습니다. 처음에는 단순히 지방 도시와 스포츠에 대해서 논하려는 듯하다가, 어느 순간부터 타운 내에서 벌어지는 아찔한 집단주의에 대해서 논하던 그 책에 빠져 하루만에 두꺼운 페이지를 다 읽어버린 기억이 있습니다. 유머와 냉소를 동시에 잃지 않는 문체가 상당히 인상적이었기 때문에, 이번에 출판된 <불안한 사람들> 또한 기대가 많았습니다.
왠만한 작품이 아닌 이상 은행강도가 등장하는 이야기에서 언제나 은행강도는 아주 잔인하게 사람들을 다룹니다. 하지만 이 책에 등장하는 은행강도는 원래 그럴 목적이 없었기 때문인지는 몰라도 도망친 모델하우스에서 자신이 붙잡은 인질들에게 상당히 쩔쩔맵니다. 심지어 인질들은 말조차도 듣지 않습니다. '그거 진짜 총 아니죠?', '무슨 강도가 그래요?'라고 놀림을 받는 한편 '당신도 강도잖아요! 걱정 말고 좀 더 제대로 해봐요!'라고 아예 강도를 응원하기까지 합니다.
사실상 소설에 등장하는 모든 사람들은 공통적으로 '불안'이라는 키워드를 껴안고 살고 있습니다. 우리가 모두 그렇듯이. 물론 개개인이 가지고 있는 불안은 제각기 다릅니다. 강도를 붙잡고자 하는 경찰은 또다시 인명 피해가 나는 것을 불안해하고, 은행 강도는 자신의 자식들을 되찾지 못할 것을 불안해하고, 인질들도 제각기 인정받지 못하는 불안, 자신의 정체를 들킬 것에 대한 불안 등 다양한 불안을 껴안고 살고 있습니다. 탁월하게 캐릭터를 펼쳐나가는 작가답게 캐릭터 설정 자체도 아주 꼼꼼하게 이루어져 있습니다.
그러나 캐릭터가 지닌 불안만큼이나 소설의 구조는 다소 불안합니다. 일관적으로 이어지지 않고 각 인물들의 이야기가 교차로 구성되어 있는 복잡한 소설의 구조는 몇 번이고 작품을 다시 읽으면서 내용을 확인해나가야 하기 때문에 다소 불편합니다. 물론 작품의 다양한 등장인물들의 이야기와 주제를 보여주기 위해서는 이러한 구성을 선택하는 게 맞겠습니다만, 번역본을 읽는 우리의 입장에서는 본문에 대한 독해력은 상당히 떨어질 수밖에 없으니 다소 아쉽게 느껴질 수밖에 없습니다.
게다가 작품의 중반부에서 레나르트의 입을 통해서 본 작품의 진짜 주제인 '사랑'이 드러납니다. 하지만 다양한 문제들을 사랑의 힘으로 결론짓고자 했던 다른 작품들이 많은 탓인지는 몰라도, 복잡한 이야기의 끝자락에서 지친 상태로 ""그럼 당신은 뭘 믿는데요?""라는 사라의 질문에 대해 레나르트가 ""사랑요.(p.341)""라고 답하는 것을 본 순간 우리는 생각보다 의아한 감정을 느끼게 됩니다. 그런 점에서 <베어타운>에서 작가의 냉철한 관찰이 주제를 확실하게 이끌어준 것과는 달리 <불안한 사람들>의 이야기는 다소 불안합니다.
물론 <불안한 사람들>의 가장 큰 장점은 작품 처음부터 끝까지 작가 특유의 유머를 잃지 않고 있다는 점이기 때문에 그것만으로도 읽을 가치는 충분합니다. 인질극 도중임에도 불구하고 피자를 시켜먹고, 그 와중에 자기가 먹고 싶은 피자를 얘기하며 티격태격하는 인질들의 모습, 당신들은 정말 최악의 인질들이에요, 한탄하는 은행 강도의 모습, 취조실에서도 어딘지 모르게 얼빠진 이야기를 하는 인질들. <불안한 사람들>은 다소 불안한 이야기더라도, 프레드릭 배크만 특유의 유머가 가장 잘 살아난 작품이라고 볼 수 있겠습니다.
#불안한사람들 #프레드릭배크만"
9791130637617,"이건 다리와 바보들과 인질극과 오픈하우스에 관한 이야기다. 하지만 사랑 이야기이기도 하다. 사실 여러 편의 사랑 이야기다. 
  프레드릭 배크만 소설의 특징.
처음에는 뜬금 없는 전개와 쏟아져 나오는 인물들에 당황스럽다. 왜 이 이야기가 나오는지 잘 모르겠다. 이 인물이 여성인지 남성인지조차 헷갈린다. 
그러다가 툭, 던져진 문구에 눈길이 머무르고 마음이 움직인다. 
오다 주웠어, 정도의 츤데레 매력이랄까. 툭툭 진지하지 않게 던지는 것 같은 글 속에 인생의 진실이 느껴진다. 아닌 척하는데 속은 따뜻한 사람을 마주하는 느낌. 
  “그거 알아요, 사라? 불안의 가장 인간적인 측면이 뭔가 하면, 우리가 혼돈을 혼돈으로 치료하려고 한다는 점이에요. 파국적인 상황으로 빨려 들어갔을 때 거기서 철수하는 사람은 거의 없고 다들 전보다 더 빠르게 계속 달리려는 성향을 훨씬 많이 보여요. 남들이 벽에 부딪히는 걸 보면서도 정작 우리는 그 벽을 무사히 관통할 수 있길 기대해요. 그 벽에 가까워질수록 믿기지 않는 해결책이 기적적으로 우리를 구원할 거라는 확신이 점점 커지지만 그동안 우리를 지켜보는 사람들은 모두 충돌을 기다리고 있죠.”
  사람들이 모여 있다. 상처 있는 사람이 상처 있는 사람을 알아보듯 불안한 사람은 서로에게 서로를 발견하며 연민의 시선을 보내고 용기를 불끈 낸다. 
'항상 실수만 반복하는 느낌이 어떤 건지' 공감하고 '어렸을 때는 얼른 어른이 되어서 모든 걸 직접 결정하고 싶어 하지만 어른이 되면 그게 가장 힘든 부분'임을 깨닫는다. '누구에게도 뭐든 증명하려고 할 필요 없다고, 당신은 그러지 않아도 충분히 훌륭하다'는 말, '당신이 잘못한 게 아니라고.' '노상은 아니지만 노상 행복할 필요는 없다는 걸 터득했고, 그래서 행복할 수 있다는 말'을 서로에게 전해 준다. 
읽다 보면 픽픽 터지는 배크만의 티키타카도 재밌지만 결국 그 따뜻한 온기에 항복하게 된다. 결국 우리는 모두 불안한 사람들이기에 서로에게 서로가 필요한 게 아닐까. 
이번에도 성공한 배크만의 유머코드에 감복하며, '다른 사람의 감정에 빗대어 자기 감정을 표현할 수 있는 사람들 사이에서 러브레터 비슷한 역할'을 하는 문학의 힘을 아는 사람에게 이 책을 권하고 싶다. 
        #불안한사람들 #프레드릭배크만 #장편소설 #다산책방 #책리뷰 "
9791130637617,"#불안한사람들 #프레드릭배크만 #다산북스

책 표지 노랑노랑에 토끼 뒷모습 너무 눈에 들어온다고 생각하며 책을 펼쳤다.
앞부분은 뭔가 추리를 하는건가 하면서 범인은 누굴까?
란 생각을 하며 읽었다.
은행을 털러 은행에 들어간 은행강도가 돈이 없는 은행에 들어갔다. 은행강도는 당황하여 어떤 아파트에 들어가게 되는데 거기서 많은 사람들의 무리를 보고 어떻게 하다보니 인질로 잡아버렸다.
이 인질들을 조사하면서 나오는 에피소드들을 풀어나가는데
읽으면 인생에 대해 내 행복은 무엇인지 나만 불안한 삶을 살아가고 있는게 아니라 내 주변의 사람들도 불안한 삶을 살아가고 있다는 걸 전해주는 책 같았다.
읽으면서 한번씩 툭툭 웃을 수 있어서 출퇴근길이 즐거웠다.

#책스타그램 #북스타그램 #독서"
9791130637617,"p46 - 다른 어떤 나라에서 금융 위기가 시작되고 뉴욕의 어느 은행이 파산하자 머나먼 지구 반대편의 어느 조그만 도시에 사는 남자는 모든 것을 잃었다.
ㆍ
12월 30일,월세 6500크로네를 구하지 못한 은행강도가 총구를 들이민 은행은 마침 '현금 미취급 은행'이었고, 화들짝 놀라 은행을 나와 얼떨결에 들어간 곳은 '오픈하우스'가 진행중인 아파트 한 집.
ㆍ
집을 보러온 사람들은 출산예정 부부, 리모델링 후 재판매를 노리는 부부, 할머니, 부동산 구경이 취미인 금융인과 이들의 중개인.
ㆍ
각자의 분야(?)에서 강하게 살아온 인생고수들 앞에서 한껏 주눅든 초보 강도는 급기야 눈물을 흘리는데...
ㆍ
먹고 사는 건 왜이리 힘들고 뻔뻔해져야 하는지, 작은 마을의 부자(F&S) 경찰은 또 왜이리 순박한지, #스톡홀름신드롬 의 나라는 역시 달라도 다르다는 인상을 남긴다.
ㆍ
과거와 현재를 오가는 진행, 고전 추리물의 서술트릭과 소소한 반전 거리가 틈틈이 녹아있으며, 따뜻한 이야기를 쓸 수밖에 없는 저자의 천성 같은 게 느껴진다. (물론 그게 천성만이겠는가, 노력하며 찾아낸 삶의 방향이기도 할 것이다)
ㆍ
처음 읽은 배크만의 책이다.
ㆍ
여러 인물들을 통해서 빌어먹을 금융위기, 정신질환, 소수자, 편견, 세대차이 등을 마주하며 서로의 간극을 어떻게 이해하고 극복할 수 있는지에 대한 저자의 고민을 충분히 느낄 수 있었던 것과는 별개로 동화 같은 긍정의 하모니가 완전하게 받ㆍ아ㆍ들ㆍ여ㆍ지지만은 않는다.
ㆍ
그러니까... 초보 강도나 경찰 부자의 허술함, 2008년 금융위기에서 비롯된 연쇄적인 어려움을 끈끈한 호의의 연대로 넘어가자는 #allforone #oneforall 의 메시지가 지나치게 환상적이고 매끈하게 진행된다.
ㆍ
저자가 작중에서 말하듯이, 우울증 약의 약성은 우울감뿐만 아니라 행복감도 느끼기 어렵게 만든다는데, 소설이 일관된 긍정으로 진행되면서 대체로 저자의 의도에 무뎌지게 된다. 상황을 복구하고 극복하는 데 의의가 있지는 않다. 호의가 불운과 불행을 덮어준다는 인상을 받았다.
ㆍ
p.s. #오리엔트특급살인 이 반전된 풍경이다."
9791130637617,"  #도서협찬 #불안한사람들
  ""결정을 못 하겠어요"". 은행강도는 말했다. 어쩌면 그날 한말 중에서 그게 가장 솔직한 말일지 몰랐다. 누구나 어렸을 때는 얼른 어른이 돼서 모든 걸 직접 결정하고 싶어 하지만 어른이 되면 그게 가장 힘든 부분임을 깨닫는다. 항상 의견이 있어야 한다는 것, 어느 당에 투표하고 어떤 벽지를 좋아하며 성적 취향이 어떻게 되고 무슨 맛 요구르트가 자신의 성격을 가장 잘 드러낼지 결정해야 한다는 것이 말이다. 어른이 되면 시종일관 시시때때로 선택하고 선택을 당해야 한다. _267~268p.
  <오베라는 남자>로 국내에서도 큰 사랑을 받았던 프레드릭 배크만. 이후 국내에 출간된 <할머니가 미안하다고 전해달랬어요> <브릿 마리 여기 있다> ,'오베라는 남자'를 뛰어넘어 열광적인 찬사를 받았던 <베어 타운>, 그 뒤를 잇는 이야기인 <우리와 당신들>역시 높은 인기를 받으며 출간하는 작품마다 작품의 성장성을 보여주는 작가 프레드릭 배크만. 3년 만에 집필한 장편소설 「불안한 사람들」은 작은 도시의 제야 전날 총을 든 강도가 돈이 없는 은행을 털려다 실패하고 얼결에 아파트 오픈 하우스에 들어간 은행강도와 인질들의 하루를 담고 있다. 새해를 앞두고 아파트 오픈 하우스를 구경하러 왔다가 인질이 된 안나레나, 로게르 부부, 율리아와 로, 에스텔과 사라, 부동산 중개업자와 토끼(?) 그리고 이 상황에 조금은 엉성해 보이는 은행강도까지.... 다리 위 남자를 구하고 싶었던 소년은 경찰이 되었고 아버지와 같은 경찰서에 근무하고 조용한 동네에 갑작스러운 은행강도 사건에 술렁이는 하루를 보내게 된다. 인질들은 무사히 구해냈지만 아파트에서 울린 한 발의 총성, 바닥에 낭자한 피, 그리고 사라진 은행강도. 이 사건을 인터뷰하는 야크와 짐은 협조적지이 않은 인질들의 수다에 점점 기가 질리고, 인질들 중에 은행강도를 도운 사람이 있다?!
  아파트를 매입해 수리해서 다시 판매하는 노부부, 집 구경을 다니는 게 취미인 은행 간부, 자녀들이 살 집을 대신 봐주러 온 할머니, 곧 아이를 출산 예정인 젊은 부부, 아르바이트 중이었던 토끼와 숨어있던 공인중개사, 사건 현장엔 없었지만 연장선상에 있었던 심리상담사. 목격자 진술서는 아무 말 대잔치 같지만 등장인물들의 이야기는 개개인의 이야기가 하나의 겹겹이 쌓여 오늘을 살아가는 우리의 인생 이야기를 보는 기분이 들게 한다. 겉으로 보이는 삶, 이면에 각기 다른 삶의 무게를 안고 살아가는 인물들의 이야기는 어른으로 사느라 힘들었던 우리에게 위로를 건네는 듯하다. 불안을 안고 살아가는 우리들의 이야기, 이 소설은 넷플릭스 영상화도 확정되었다고 하는데 생생한 영상으로의 이야기도 궁금해지는 소설이다.
  계획도 없고 그저 최선을 다해 오늘 하루를 살아갈 뿐이다. 날이 밝으면 또 다른 하루가 시작될 테니까.
가끔은 껍데기가 내 것이 아닌 것처럼 느껴진다는 이유 하나만으로 가슴이 정말 아플 때도 있다. 공과금도 내야하고 어른도 되어야 하는데 어른이 되는 법을 몰라서, 어른이 된다는 것은 실패할 확률이 지독히 높은 일이라서 겁에 질릴 때도 있다. _16p.
  어른이 되는 것이 끔찍한 이유는 아무도 우리에게 관심이 없고, 앞으로는 스스로 모든 일을 처리하고 세상이 어던 식으로 돌아가는지 파악해야 한다는 것을 깨닫는 순간이 찾아오기 때문이다. (···) 하지만 우리는 아직 어른이 될 준비가 되지 않았다. 누군가가 진작 우리를 말렸어야 했다. _74p.
  사람들은 좋은 사람이 되고 싶어 한다. 속으로는 그렇다. 친절한 사람이 되고 싶어 한다. 물론 문제가 있다면 바보들 같은 경우에는, 그들이 바보라서 친절하지 못할 때도 있다는 것이다. _156p.
  진실. 세상에 진실은 없다. 우리가 우주의 경계에 대해 어찌어찌 알아낸 게 있다면 우주에는 경계가 없다는 것뿐이고, 신에 대해 아는 게 있다면 우리는 아무것도 모른다는 것뿐이다. 따라서 목사였던 어머니가 가족들에게 요구한 것은 간단했다. 최선을 다하라는 것. 내일 지구가 멸망하더라도 오늘 사과나무를 심으라는 것.
구할 수 있는 사람은 구하라는 것. _473p.
  #ANXIOUS_PEOPLE #FREDRIK_BACKMAN #프레드릭배크만 #이은선 #소설 #다산책방 #까망머리앤의작은서재
  본 서평은 출판사로부터 해당 도서만 제공받아 주관적인 감상으로 작성하였습니다.
     
 "
9791130637617,"[불안한 사람들 ]
프레드릭 배크만 지음 / 다산북스 출판사
완벽하지도 않은 , 구멍도 많고 상처도 많은 사람들의 이야기가 어떻게 이렇게 아름다울수 있을까 생각했다.
시작은 스릴러물처럼 은행강도가 등장하고 경찰이 등장하지만 , 중간부는 우연하게 인질범으로 잡힌 개성강한 8인의 등장으로 배꼽잡고 , 후반부는 이렇게 불완전한 사람들이야말로 서로를 구원해줄수 있는 가장 완전한 사람들이라는 생각에 혼자 펑펑 울고 ..진짜 너무너무 웃긴데 또 너무너무 아름다워서 눈물콧물 쏙 뺀 이야기 !
스토리 중심의 빠른 전개가 책장을 후루룩 넘기게 만들었지만, 각기 다른 캐릭터에 공들인 작가의 애정만큼이나 한명 한명 다 내 모습이 녹아있어서 모두 안아주고 쓰다듬어줄수 밖에 없었다 . 그들은 나의 이야기이기도 하고 내 가족의 이야기이기도 하고 내 주변의 누군가의 이야기이기도 했으니까 말이다.
아파트 오픈 하우스에 있는 아홉명의 사람들은 완벽한 남남이었다. 각자 나름의 사연을 가지고 그 장소에 모였지만 서로 모르는 사람들이었고 타인의 상처따위에는 관심도 없었다. 적당한 거리를 돈을 주고 살수 있는 능력..이것이 성공의 척도가 되는 세상이라면 타인과의 적당한 거리는 오히려 안전한 조치일수도 있지 않을까 ?
한 공간에서 부대끼던 9인의 타인들은 서로의 사연을 공유하면서 친구가 된다. 그 짧은 시간에 어떻게 그게 가능하지 싶다가도 한정된 공간과 시간을 함께 공유한다는 건 내가 생각했던 것보다 더 어마어마한 일일수도 있겠다 싶다.
불안한 시대에 살아가고 있기때문에 우리는 덜 불안해지기 위해 매순간 애쓴다. 이렇게 생각을 바꿔보면 어떨까? 불안한 시대를 살고 있기때문에 불안은 어쩔수 없는거지 . 불안한 감정은 당연한거야 라고 ! 불안함이 없는 삶이어야만 완벽한 삶인걸까 ? 너도 나도 불안을 껴안고 살아갈수 밖에 없다면 대신 , 언제어디서나 녹슬지 않는 유머감각 그리고 타인의 힘든 삶을 외면하지 않는 용기하나는 꼭 챙겼으면 좋겠다. 불완전한 타인에게 건네는 한번의 관대함과 한번의 관심과 한번의 기회는 서로를 지켜주는 든든한 울타리가 되어줄테니까.
우리 모두는 어떤 식으로든 다 연결되 있는 하나의 지구라는 사실을 잊지 않았으면 한다. <오베라는 남자>를 읽고 작가님이 좋아졌다면 이 책을 읽고 나서는 작가님을 정말 정말 사랑하게 되었다고 말하고 싶다.
당신은 혼자가 아니라는 사실을 확인받고 싶다면 꼭 이 책을 읽어보시길 ^^
우리는 그 누구에게도 완벽한 타인이 될수 없는 운명이다. 불완전하기에 타인의 상처를 알아볼수 있고 불완전하기에 공감할수 있는것이다. 내 상처를 감싸든 타인도 가만히 감싸게 되는 놀라운 소설
 "
9791130637617,"저는 소설책을 좋아하지 않는데 이 책은 정말 재미있게 읽었습니다ㅎㅎ
개인적으로 일이 좀 있어 기운이 없었는데 이 책을 읽으면서 점점 기운을 되찾았습니다.
일단 곳곳에 유머 코드가 가득해 즐겁고 지겹지 않게 읽을 수 있었고 중간 중간에 의미 있는 메세지를 정리해서 알려주는데 와 닿는 메세지가 많았습니다.
정말 세상에는 다양한 사람들이 있고 각자 다 사연이 있는 듯 합니다.
자기만의 세계에 갇혀 너무 좁게 생각하지 말고 머리와 마음을 열고 더 포용하고 수용할 수 있는 사람이 되야 겠습니다.
좀 더 나은 사람이 되는 것보다 주변 사람들과 즐겁게 어울리고 소통하며 하루하루 더 행복하게 사는 삶이 더 값진 것이 아닐까 생각해 봅니다.
 "
